status_id,status_message,link_name,status_type,status_link,status_published,num_reactions,num_comments,num_shares,num_likes,num_loves,num_wows,num_hahas,num_sads,num_angrys
1402426450028275_1498857630385156,Most people consider the Vikings' trade for Herschel Walker among the worst ever made. Except for Jimmy Johnson. He'd say it's the best.,The Great Trade Robbery,video,https://www.facebook.com/ESPNews/videos/1498857630385156/,2014-10-28 11:49:52,118,19,32,118,0,0,0,0,0
1402426450028275_1412597899011130,"Russian native Andrei Kirilenko is bringing five ""Hooters"" restaurants back to Moscow. Kirilenko said, ""the biggest challenge will be overcoming the notion that it's a strip bar.""","Ross' diss, Hooters and merch",link,http://espn.go.com/blog/new-york/brooklyn-nets/post/_/id/17804/notebook-ross-diss-hooters-and-merch?ex_cid=espnapi_public,2014-04-18 13:45:00,7,1,0,7,0,0,0,0,0
1402426450028275_1412597552344498,"John Elway didn't attend any of the four scouting combines in 1983, and was still selected first overall. Elway: ""I had bad knee and I just didn't want everybody to see it.""",Pre-draft dance has been around a while,link,http://espn.go.com/blog/denver-broncos/post/_/id/6187/pre-draft-dance-has-been-around-a-long-time,2014-04-18 12:51:00,8,0,0,8,0,0,0,0,0
1402426450028275_1411898749081045,"Lorde finally meets inspiration behind her song ""Royals,"" Hall of Famer George Brett. Yes, you read that correctly. » http://es.pn/RpaQzW",Lorde finally meets George Brett,link,http://es.pn/RpaQzW,2014-04-16 15:31:50,35,3,14,35,0,0,0,0,0
1402426450028275_1411449229125997,New York City businessman and billionaire Donald Trump says he's committed to buying and keeping the Bills in western New York.,He's serious: Trump wants to purchase Bills,link,http://espn.go.com/nfl/story/_/id/10785589/donald-trump-interested-buying-buffalo-bills,2014-04-15 12:01:44,26,7,1,26,0,0,0,0,0
1402426450028275_1408060639464856,"It's not the Game 6 winner, but Michael Jordan is pumped after sinking this 50-foot putt at his celebrity invitational. ",Michael Jordan Sinks 50 Foot Putt,link,http://es.pn/1lJ1ECQ,2014-04-06 14:35:00,64,3,11,64,0,0,0,0,0
1402426450028275_1408046179466302,"Today I learned that in 2004, Reds' outfielder Adam Dunn became the first (and only) MLB player to hit a home run that landed in another state (thanks reddit)",Stark: Wild Pitches,link,http://sports.espn.go.com/mlb/columns/story?id=1863991,2014-04-06 13:20:45,59,4,14,59,0,0,0,0,0
1402426450028275_1407244579546462,Opening day at Fenway Park for the Red Sox kicked off with 2013 World Series celebration and ring ceremony. Here are the World Series rings,Snapshot: Red Sox World Series rings,link,http://espn.go.com/blog/boston/red-sox/post/_/id/35612/snapshot-red-sox-world-series-rings?ex_cid=espnapi_public,2014-04-04 16:43:18,39,1,1,39,0,0,0,0,0
1402426450028275_1406646226272964,"Ron Jaworski's top 5 NFL Draft QB prospects:

1 Blake Bortles
2 Zach Mettenberger
3 Teddy Bridgewater
4 Johnny Manziel
5 Derek Carr

Which QB would you take first?
",Jaws: My top five QB prospects,link,http://es.pn/1gKR1MT,2014-04-03 11:00:01,13,24,4,13,0,0,0,0,0
1402426450028275_10152163899724272,"Short, skinny & deadly, with the best shot in NBA history. That'd be Golden State Warriors Stephen Curry and his 3.",NBA: Breaking down Curry's perfect shot,link,http://es.pn/1jUrNi1,2014-04-01 19:30:01,77,11,23,77,0,0,0,0,0
1402426450028275_10152163463739272,"Buffalo Bills HOF QB Jim Kelly says his faith is the key to his cancer battle. 

He begins chemotherapy next week. 

MUST READ -> http://es.pn/1pHITNu",Hall of Famer Kelly: Faith fuels cancer battle,link,http://es.pn/1pHITNu,2014-04-01 13:23:44,181,9,13,181,0,0,0,0,0
1402426450028275_10152163087624272,"""It's hard to decide what someone is best at when the answer might be 'everything.'""

If Anthony Davis isn't on your team, you should be very afraid.",Building the Brow,link,http://grantland.com/features/building-the-brow/,2014-04-01 09:19:43,59,3,6,59,0,0,0,0,0
1402426450028275_10152162177399272,"Oakland Athletics Josh Donaldson found an escape in baseball, then became one of the game's best. #MLBPreview #OpeningDay",MLB: How Donaldson became top 3B,link,http://es.pn/1e4R6Gp,2014-04-01 04:00:00,5,0,0,5,0,0,0,0,0
1402426450028275_10152157248339272,"Former Marine Steve Walker has lost his sight, but not his vision of someday racing in Kona. (via USA Triathlon)",Williams: Athletic visions for blind former Marine,link,http://espn.go.com/sports/endurance/story/_/id/10683105/endurance-sports-blindness-stopping-former-marine-steve-walker,2014-03-29 14:05:00,9,0,0,9,0,0,0,0,0
1402426450028275_10152157242959272,One of the best articles you will ever read that describes the love between the Flyers and Flyer Faithful. Let's keep it rolling today #FlyerNation,"Love story: Flyers, Dayton flying high",link,http://espn.go.com/blog/collegebasketballnation/post/_/id/97641/love-story-flyers-dayton-flying-high,2014-03-29 11:17:02,29,0,2,29,0,0,0,0,0
1402426450028275_10152156888719272,"""We're never going back to the days when Joe Horn was pulling a cell phone out of the goalpost.""","Best/Worst: The NFL Fun Police, College Lawsuits, and Dwyane Wade",link,http://grantland.com/the-triangle/bestworst-the-nfl-fun-police-college-lawsuits-and-dwyane-wade/,2014-03-29 09:30:01,27,0,3,27,0,0,0,0,0
1402426450028275_10152156857224272,No. 8-seeded Kentucky upset the defending champion and No. 4-seeded Louisville 74-69 to advance to the Elite Eight,UK surges to boot defending champ L'ville,link,http://espn.go.com/ncb/recap?gameId=400548877,2014-03-29 06:51:24,27,1,0,27,0,0,0,0,0
1402426450028275_10152154975309272,The pursuit of imperfection: The Sixers' loss last night tied the record for longest losing streak by any team in NBA history set by the Cavaliers in 2010-11,Daily Dime: Philly's losing battle,link,http://es.pn/O4Clw0,2014-03-28 10:23:08,6,0,1,6,0,0,0,0,0
1402426450028275_10152154636589272,Can Major League Soccer (MLS) ever escape the shadow of European football and become a dominant world league? ,MLS' biggest competitor is European football by Roger Bennett,link,http://es.pn/1pApI8h,2014-03-28 09:00:00,4,5,1,4,0,0,0,0,0
1402426450028275_10152154635619272,Holy cow! Love the celebrations! Keep it going Flyer Nation! (via Official University of Dayton Men's Basketball Page),Dayton fans erupt in celebration after Sweet 16 win,link,http://espn.go.com/mens-college-basketball/story/_/id/10686200/dayton-flyers-fans-celebrate-school-first-elite-eight-trip-30-years,2014-03-28 07:05:00,28,0,0,28,0,0,0,0,0
1402426450028275_10152154634554272,Kyle Long is happy to call new Bears DE Jared Allen a teammate after dreading playing against him. ,Long happy to have Allen as teammate,link,http://es.pn/1fp8gyD,2014-03-28 06:10:26,38,5,0,38,0,0,0,0,0
1402426450028275_10152151925359272,"In a hypothetical Subway Series, 59 percent of New Yorkers would root for the Yankees, and 37 percent would favor the Mets. (thx FiveThirtyEight)",Yankees vs. Mets: The Battle For New York's Heart,link,http://fivethirtyeight.com/datalab/yankees-vs-mets-the-battle-for-new-yorks-heart/,2014-03-27 21:00:01,5,0,1,5,0,0,0,0,0
1402426450028275_10152153705264272,"Film geeks for the world, here's your newest topic of debate. Brought to you with insane thoroughness of Bill Simmons and Grantland.",The Action Hero Championship Belt,link,http://grantland.com/features/the-action-hero-championship-belt/,2014-03-27 20:05:00,8,1,4,8,0,0,0,0,0
1402426450028275_10152153689134272,Who should be No. 1 on the #BBTN100? Find out tonight at 10 p.m. ET on ESPN & WatchESPN,BBTN 100: Any Debate Over No. 1?,link,http://es.pn/1gut2kN,2014-03-27 19:00:00,5,1,1,5,0,0,0,0,0
1402426450028275_10152153686704272,Former Broncos RB Knowshon Moreno has reached agreement on a 1-year deal with the Miami Dolphins. ,"Source: Dolphins, Moreno have 1-year deal",link,http://es.pn/1hyLkgY,2014-03-27 18:00:00,38,2,4,38,0,0,0,0,0
1402426450028275_10152153685419272,Baltimore Ravens RB Ray Rice was indicted by a grand jury on third-degree aggravated assault for allegedly striking his fiancee unconscious last month. ,Ravens' Rice indicted for aggravated assault,link,http://es.pn/1m8OagK,2014-03-27 17:05:01,33,27,17,33,0,0,0,0,0
1402426450028275_10152153514514272,"Tom Brady witnesses deadly fire in Boston: ""We as athletes think we're heroes, but when you witness first-hand what we saw yesterday you realize who the real heroes are in this world. It's the people that work hard to protect our lives and protect our safety.""",Pats' Brady witnesses deadly fire in Boston,link,http://es.pn/1hxkaXF,2014-03-27 14:46:57,209,10,31,209,0,0,0,0,0
1402426450028275_10152152827994272,"Good news Atlanta Falcons fans, WR Julio Jones is ahead of schedule in his rehab coming off season-ending foot surgery.","Mike Smith excited, cautious about Jones",link,http://es.pn/1ePIs1M,2014-03-27 09:05:00,14,11,3,14,0,0,0,0,0
1402426450028275_10152152824999272,The NFL will experiment with placing ball at 20-yard line for extra-points in the first 2 weeks of preseason.,NFL goalpost uprights to increase to 35 feet,link,http://es.pn/1dvVdjS,2014-03-27 08:15:01,21,5,3,21,0,0,0,0,0
1402426450028275_10152152821929272,"#SRT Twenty20 years ago today, Sachin Tendulkar first opened for India in ODIs. He made an amazing 82 off 49 balls (15 fours, two sixes). As an opener, he made a total of 15,310 runs with 45 hundreds. Do you remember that innings in Auckland? ","New Zealand v India, Auckland",link,http://es.pn/SRTopens,2014-03-27 06:02:26,3,0,0,3,0,0,0,0,0
1402426450028275_10152151948904272,"No expanded playoffs for the NFL, yet.. Read more >> http://espn.go.com/nfl/story/_/id/10676712/roger-goodell-says-more-work-needed-expanding-nfl-postseason",Goodell: More needed for expanded playoffs,link,http://espn.go.com/nfl/story/_/id/10676712/roger-goodell-says-more-work-needed-expanding-nfl-postseason,2014-03-26 19:50:00,4,1,1,4,0,0,0,0,0
1402426450028275_10152151601044272,"New York Yankees are most valuable American sports franchise for 17th straight year, according to Forbes annual list. Yanks are worth $2.5 billion.",Forbes: Yankees most valuable at $2.5B,link,http://es.pn/1o162Px,2014-03-26 17:05:00,10,0,0,10,0,0,0,0,0
1402426450028275_10152151635924272,Tonight's Miami Heat vs Indiana Pacers game has the feel of a heavyweight bout -- with all the muscle to back it up,Windhorst: Heat-Pacers a heavyweight bout,link,http://es.pn/P0XEzu,2014-03-26 16:45:01,20,2,1,20,0,0,0,0,0
1402426450028275_10152151896039272,THIS JUST IN: Chicago Labor Relations Board rules that Northwestern football players qualify as employees and can unionize. ,Northwestern football players win bid to unionize,link,http://es.pn/1haO7Al,2014-03-26 16:26:22,7,0,5,7,0,0,0,0,0
1402426450028275_10152151593089272,"While recovering from his ankle injury, Miami's Duke Johnson has dedicated himself to the weight room. Now he's up to 205 lbs. — 25 more than he was in '12 — and can do 18 bench reps of 225.",Duke Johnson hard at work this spring,link,http://espn.go.com/blog/ncfnation/post/_/id/94254/duke-johnson-hard-at-work-this-spring,2014-03-26 16:00:00,6,0,0,6,0,0,0,0,0
1402426450028275_10152151262504272,"Jerry Jones said that despite the loss of DeMarcus Ware, the Cowboys are not in rebuilding mode -- specifically because they have Tony Romo. Do you agree?",Jones says Cowboys not in rebuilding mode,link,http://es.pn/NPpvlf,2014-03-26 14:00:01,12,11,1,12,0,0,0,0,0
1402426450028275_10152151258049272,Stat of the Day: Philipp Lahm attempted 136 passes for FC Bayern München yesterday. He completed all 136.,Press praise Bayern's title heroics,link,http://es.pn/1l4bFrs,2014-03-26 12:40:00,8,0,0,8,0,0,0,0,0
1402426450028275_10152150741254272,Florida State's Jameis Winston was involved in a benches-clearing brawl in the Seminoles' baseball game with the Florida Gators,"Florida State, Winston in fracas with Gators",link,http://espn.go.com/college-sports/story/_/id/10674862/florida-gators-upset-florida-state-seminoles-benches-clearing-fracas,2014-03-26 11:05:00,21,8,3,21,0,0,0,0,0
1402426450028275_10152150729274272,"Derrick Rose really is out, but the resilient Bulls are all in as they push toward the playoffs.","Greenberg: Rose not coming back, and Bulls just fine with that",link,http://es.pn/1ljM3JC,2014-03-26 07:30:01,5,1,1,5,0,0,0,0,0
1402426450028275_10152150728199272,Best wishes and prayers to Buffalo Bills HOF QB Jim Kelly who is expected to undergo more cancer surgery on Thursday. Kelly's wife Jill says his oral cancer is aggressive and spreading.,"Wife: Kelly's cancer aggressive, spreading",link,http://es.pn/ORjd5I,2014-03-26 05:53:30,22,3,2,22,0,0,0,0,0
1402426450028275_10152150022674272,The NFL's head of officiating Dean Blandino tells the Dan Patrick Show it will now be a PENALTY if a player dunks over the goalpost. ,NFL to penalize goalpost dunk next season,link,http://es.pn/1dt09Gi,2014-03-25 20:05:00,16,13,3,16,0,0,0,0,0
1402426450028275_10152149116204272,"Lakers' Nick Young says nearly $100,000 in items, including his Red October Yeezys, were stolen from his home",Young: House robbed of $100K during game,link,http://es.pn/1gUXuzF,2014-03-25 10:05:51,2,1,1,2,0,0,0,0,0
1402426450028275_10152148153624272,"$25 CORN DOG! Arizona Diamondbacks to sell new 18-inch ""D-Bat Dog"" filled with bacon, cheddar & jalapeños.",Heavy hitter: D-backs plate up $25 corn dog,link,http://es.pn/OtEv9u,2014-03-25 09:15:00,2,0,1,2,0,0,0,0,0
1402426450028275_10152147889239272,"""They're trying to take over every night of TV. It's all football. At some point, the people get sick of it."" - Mark Cuban",Cuban: Fans will turn off 'greedy' NFL,link,http://espn.go.com/dallas/nba/story/_/id/10662203/dallas-mavericks-owner-mark-cuban-says-greedy-nfl-10-years-away-implosion,2014-03-24 21:05:00,9,6,0,9,0,0,0,0,0
1402426450028275_10152147883269272,Kobe Bryant says Lakers should work toward making the greatest comeback ever after a brutal season. » http://es.pn/1iTQFnd,Kobe Bryant Sunday Conversation,link,http://es.pn/1iTQFnd,2014-03-24 19:52:24,9,0,3,9,0,0,0,0,0
