status_id,status_message,link_name,status_type,status_link,status_published,num_reactions,num_comments,num_shares,num_likes,num_loves,num_wows,num_hahas,num_sads,num_angrys
889307941125736_1316994268357099,"""I'm closing this campaign the way that I started my career, fighting for kids and families, standing up for fairness and opportunity, for justice, equality, taking on all those kitchen table issues that keep people up at night."" —Hillary",Timeline Photos,photo,https://www.facebook.com/hillaryclinton/photos/a.889773484412515.1073741828.889307941125736/1316994268357099/?type=3,2016-11-06 09:02:30,70503,5739,5832,62610,7224,79,345,18,227
889307941125736_1316222755100917,"""Lo que estoy diciendo es que sacar a los inmigrantes indocumentados de las sombras y llevarlos a la economía formal sería bueno. Porque entonces los empleadores no pueden explotarlos ni rebajar los salarios de los estadounidenses. Y Donald sabe mucho de esto. Él usó a trabajadores indocumentados para construir la Trump Tower. Pagó menos a los trabajadores indocumentados. Y cuando se quejaron, él les dijo lo que dicen muchos empleadores, 'si te quejas, serás deportado'. Yo quiero que todos salgan de las sombras, hacer que la economía funcione y evitar que empleadores como Donald Trump exploten a los trabajadores indocumentados, lastimándolos y a todos los trabajadores estadounidenses"".",Timeline Photos,photo,https://www.facebook.com/hillaryclinton/photos/a.889773484412515.1073741828.889307941125736/1316222755100917/?type=3,2016-11-06 08:00:01,36368,3941,3365,32623,3214,109,80,28,314
889307941125736_1316220601767799,"We face a serious choice on Tuesday: Will we act to protect the planet for our kids and grandkids, or do nothing? hillaryclinton.com/makeaplan",Timeline Photos,photo,https://www.facebook.com/hillaryclinton/photos/a.889773484412515.1073741828.889307941125736/1316220601767799/?type=3,2016-11-06 00:00:00,24761,3468,1442,22390,2002,59,67,19,224
889307941125736_1316184778438048,"On this day in 1872, Susan B. Anthony voted in a presidential election—and was then arrested. Almost 50 years later, the Nineteenth Amendment was ratified, prohibiting states from denying women the right to vote. hillaryclinton.com/makeaplan",Timeline Photos,photo,https://www.facebook.com/hillaryclinton/photos/a.889773484412515.1073741828.889307941125736/1316184778438048/?type=3,2016-11-05 21:15:17,53767,3805,10797,47755,5084,561,131,80,156
889307941125736_1316096001780259,Five women older than their right to vote share why they're with Hillary: hrc.io/2frj6gj,"These ladies were born before women had the right to vote. Now they're saying, ""I'm with her.""",link,http://hrc.io/2frj6gj,2016-11-05 20:00:00,63517,3211,4697,55561,7348,341,95,34,138
889307941125736_1316016751788184,"For respect.
For the future.
For our planet.

On Tuesday, they're gonna hear us roar: hillaryclinton.com/makeaplan",,video,https://www.facebook.com/hillaryclinton/videos/1316016751788184/,2016-11-05 18:44:41,35242,3334,8203,30220,4615,57,173,11,166
889307941125736_1315835788472947,Your vote could make all the difference. Confirm where you'll cast your vote for Hillary: hillaryclinton.com/makeaplan,Timeline Photos,photo,https://www.facebook.com/hillaryclinton/photos/a.889773484412515.1073741828.889307941125736/1315835788472947/?type=3,2016-11-05 16:39:55,34254,4391,1493,31278,2615,36,166,11,148
889307941125736_1315541978502328,"Trump basó su campaña en atacar a latinos e inmigrantes.

Ahora, ellos tienen el poder de frenarlo, votando: hillaryclinton.com/planparavotar",,video,https://www.facebook.com/hillaryclinton/videos/1315541978502328/,2016-11-05 12:48:38,18448,4313,4662,15941,1490,70,100,80,767
889307941125736_1315266255196567,"Share this if you agree we need to keep moving forward, not back. hillaryclinton.com/makeaplan",Timeline Photos,photo,https://www.facebook.com/hillaryclinton/photos/a.889773484412515.1073741828.889307941125736/1315266255196567/?type=3,2016-11-05 10:55:04,123068,6247,17958,113522,8486,138,552,28,342
889307941125736_1315070801882779,"""That reporter and I have the same condition. When Mr. Trump made fun of him, that hurt my feelings.""",,video,https://www.facebook.com/hillaryclinton/videos/1315070801882779/,2016-11-05 08:35:00,44146,5126,17510,33315,3154,163,135,6536,843
889307941125736_1314526718603854,Más de 200 milllones de personas ya se han registrado y el número continúa aumentando. Haz tu plan para votar aquí: hillaryclinton.com/planparavotar,Timeline Photos,photo,https://www.facebook.com/hillaryclinton/photos/a.889773484412515.1073741828.889307941125736/1314526718603854/?type=3,2016-11-05 06:00:01,27775,3892,1619,25080,2332,76,63,5,219
889307941125736_1314436675279525,"La decisión que tomemos en cuatro días tendrá un efecto en nuestro país
por décadas. hillaryclinton.com/planparavotar

Comparte esto si estás de acuerdo:",Timeline Photos,photo,https://www.facebook.com/hillaryclinton/photos/a.889773484412515.1073741828.889307941125736/1314436675279525/?type=3,2016-11-04 22:59:00,17744,4259,1645,15887,1554,46,129,5,123
889307941125736_1314433285279864,More people are voting in this election than ever before. Make a plan to vote today: hillaryclinton.com/makeaplan,Timeline Photos,photo,https://www.facebook.com/hillaryclinton/photos/a.889773484412515.1073741828.889307941125736/1314433285279864/?type=3,2016-11-04 22:15:06,52952,3776,2248,48957,3510,142,112,10,221
889307941125736_1314239878632538,"Donald Trump is running the most divisive, hateful, and dangerous campaign in history. Make a plan to vote, and share this with a friend to keep him out of the White House: hillaryclinton.com/makeaplan","Donald Trump announced his campaign for president 505 days ago. Then, he did all of this.",link,http://hrc.io/2fl2eaF,2016-11-04 19:24:44,19726,4689,3575,16611,562,186,205,185,1977
889307941125736_1314028881986971,"The energy we're seeing on this campaign isn't about what we're against; it's about what we're for—a hopeful, inclusive America where everyone counts and everyone has a place. hillaryclinton.com/makeaplan",Timeline Photos,photo,https://www.facebook.com/hillaryclinton/photos/a.889773484412515.1073741828.889307941125736/1314028881986971/?type=3,2016-11-04 17:48:08,35774,4222,2271,32291,3090,38,204,7,144
889307941125736_1313815992008260,"""I sorta get away with things like that."" —Donald Trump, on bursting into Miss Universe pageant dressing rooms",,video,https://www.facebook.com/hillaryclinton/videos/1313815992008260/,2016-11-04 15:22:45,16857,5021,5731,11143,287,724,125,298,4280
889307941125736_1313694662020393,"""You are the change makers, the path breakers, and the ground shakers. You are proof that Black Girl Magic is real."" —Hillary hrc.io/2f2kFTr",,video,https://www.facebook.com/hillaryclinton/videos/1313694662020393/,2016-11-04 13:57:58,25628,4695,5197,22029,3152,49,95,14,289
889307941125736_1313549148701611,"The decision we make in four days will affect our country for decades. hillaryclinton.com/makeaplan

Share this if you agree:",Timeline Photos,photo,https://www.facebook.com/hillaryclinton/photos/a.889773484412515.1073741828.889307941125736/1313549148701611/?type=3,2016-11-04 12:19:04,66779,5944,8225,61361,4774,43,311,26,264
889307941125736_1313029225420270,"""The good news is, all of you are uniquely qualified to make sure this guy who is uniquely unqualified does not become President. You just got to vote. You just got to vote. And the nice thing is, you don't just have to vote against that guy because you've got a candidate who is actually worthy of your vote—who is smart, and who is steady, and who is tested, is probably the most qualified person ever to run for this office, and that is the next President of the United States, Hillary Clinton.

Hillary, she just works through whatever is in front of her. She's got grit and she's got resilience. And if she gets knocked down, she just comes back up and she goes back at it. And she knows, most importantly, what the decisions that a President makes means to you.  

This isn't abstract stuff we're talking about here. If you're a student, whether you get a Pell grant or were able to make sure that you don't have a mountain of debt when you get out of school, that depends on decisions that are made in part by the President. If you're a soldier, whether you get deployed to some far-off land, that is up to the Commander-in-Chief. If you're a young person who was brought to this country as a child, has grown up as an American but maybe doesn't have the papers and now you're trying to figure out how you can contribute to this country you call home, that is something the President has influence over. Veterans, seniors, a single mom who needs some help with child care—that's what these decisions are about. And Hillary understands that, and she knows those folks need a champion.

And she's actually got plans to help. She's actually got plans. The other guy is not a big plan guy. She's got plans. She can show you how she's going to make sure more people have early childhood education. She's going to show how young people can have more affordable college education. And while she's executing those plans, she's also going to respect working Americans and the values we care about."" —President Obama",Timeline Photos,photo,https://www.facebook.com/hillaryclinton/photos/a.889773484412515.1073741828.889307941125736/1313029225420270/?type=3,2016-11-04 08:30:02,34994,5653,3332,31073,3453,65,253,8,142
889307941125736_1312384335484759,Comparte esto si piensas que los niños y las familias merecen a alguien que luche por ellos en la Casa Blanca. hillaryclinton.com/planparavotar,Timeline Photos,photo,https://www.facebook.com/hillaryclinton/photos/a.889773484412515.1073741828.889307941125736/1312384335484759/?type=3,2016-11-03 23:30:01,11012,3907,1457,9699,1062,17,50,6,178
889307941125736_1312547962135063,"""I'm also honored to have the greatest temperament that anybody has."" —Donald Trump

About that:",,video,https://www.facebook.com/hillaryclinton/videos/1312547962135063/,2016-11-03 22:30:00,24891,5574,7671,18546,501,363,3661,162,1658
889307941125736_1312102485512944,The Central Park Five were exonerated. What does it say about Trump that he thinks they should still be in prison?,,video,https://www.facebook.com/hillaryclinton/videos/1312102485512944/,2016-11-03 20:04:41,23904,4752,2956,21080,1798,437,73,102,414
889307941125736_1312243758832150,Join Hillary on the trail in North Carolina with Bernie Sanders and Pharrell Williams. hillaryclinton.com/makeaplan,,video,https://www.facebook.com/hillaryclinton/videos/1312243758832150/,2016-11-03 19:00:52,176647,208078,23287,108556,50883,1013,1935,870,13390
889307941125736_1311905142199345,"First lady of Arkansas
First lady of the United States
Senator
Secretary of state
President? That's up to you:
hillaryclinton.com/makeaplan",Timeline Photos,photo,https://www.facebook.com/hillaryclinton/photos/a.889773484412515.1073741828.889307941125736/1311905142199345/?type=3,2016-11-03 14:58:19,55001,6173,2995,48986,5311,96,363,16,229
889307941125736_1311524512237408,"Trump has built his campaign on demonizing Latinos and immigrants.

Latino voters have the power to stop him. Vote: hillaryclinton.com/makeaplan",,video,https://www.facebook.com/hillaryclinton/videos/1311524512237408/,2016-11-03 11:58:03,23400,5992,7225,19527,1738,137,127,219,1652
889307941125736_1311363455586847,Share this if you think kids and families deserve a champion in the White House. hillaryclinton.com/makeaplan,Timeline Photos,photo,https://www.facebook.com/hillaryclinton/photos/a.889773484412515.1073741828.889307941125736/1311363455586847/?type=3,2016-11-03 10:41:36,57741,5663,7250,52512,4475,59,514,10,171
889307941125736_1311273695595823,"The Republican nominee for president is enthusiastically supported by the KKK's official newspaper. 

Here's what you can do about it: IWillVote.com",Donald Trump just got one of his only newspaper endorsements … and it's from the Ku Klux Klan.,link,http://hrc.io/2ffWPSg,2016-11-03 09:53:25,17771,6718,5660,10990,165,1643,875,394,3704
889307941125736_1310629525660240,"""I'm casting my vote early for Hillary Clinton, and I urge you to vote early for Hillary, too."" —Michelle Obama",,video,https://www.facebook.com/hillaryclinton/videos/1310629525660240/,2016-11-03 07:00:00,65909,8172,12553,58032,6822,62,601,32,360
889307941125736_1310624855660707,Más de 10 millones de personas ya han votado en esta elección. Encuentra en dónde puedes votar temprano aquí: VoyaVotar2016.com,Timeline Photos,photo,https://www.facebook.com/hillaryclinton/photos/a.889773484412515.1073741828.889307941125736/1310624855660707/?type=3,2016-11-02 23:35:01,16609,5136,925,14847,1420,36,72,8,226
889307941125736_1310619265661266,Sign up for the chance to join Hillary on election night in NYC—and bring a guest! We'll take care of the details: hrc.io/2efDE8P,Enter to win a trip to Hillary's Election Night party!,link,http://hrc.io/2efDE8P,2016-11-02 23:16:46,18624,3975,972,16685,1475,32,186,7,239
889307941125736_1310539592335900,"6 days until the most important election of our lifetimes. hillaryclinton.com/makeaplan

Join Hillary live in Arizona →",,video,https://www.facebook.com/hillaryclinton/videos/1310539592335900/,2016-11-02 22:14:35,117128,111489,9920,78414,31371,588,914,281,5560
889307941125736_1310440422345817,"""I can say with confidence there has never been a man or a woman—not Bill, not me—more qualified than Hillary Clinton to serve as president of the United States of America."" —President Obama 

On this team? Make a plan to vote: hrc.io/2efnZGH",Barack Obama is with her.,link,http://hrc.io/2efnZGH,2016-11-02 20:56:54,40530,6102,3402,36297,3280,80,621,26,226
889307941125736_1310224979034028,"""I know it sometimes seems a little odd for someone running for president to say we need more love and kindness in America. But I'm telling you from the bottom of my heart, we do.""",,video,https://www.facebook.com/hillaryclinton/videos/1310224979034028/,2016-11-02 18:34:58,60246,6805,12856,50187,9360,66,185,23,425
889307941125736_1310096082380251,"Trump ""doesn't look at us as full human beings, with our dreams and our purposes, our own capabilities.""",Hillary Clinton tears into Donald Trump for his appalling treatment of women.,link,http://hrc.io/2eW7nI2,2016-11-02 17:36:02,40271,7068,3003,36247,2797,88,269,152,718
889307941125736_1309824979074028,"""I've been bullied for being Muslim. ... It hurts, you know.""

This is the Trump Effect:",,video,https://www.facebook.com/hillaryclinton/videos/1309824979074028/,2016-11-02 15:19:33,29491,5967,12111,20089,601,163,164,5707,2767
889307941125736_1309730645750128,"Cuando 27 millones de personas están fuertes, nadie puede decirles que no pertenecen a este país. hillaryclinton.com/planparavotar",,video,https://www.facebook.com/hillaryclinton/videos/1309730645750128/,2016-11-02 14:22:32,13995,3516,1857,12361,1385,18,121,7,103
889307941125736_1309604815762711,"Our choice is between the most experienced, qualified candidate in decades—and a man who once started a Twitter war with Cher. hillaryclinton.com/makeaplan",Timeline Photos,photo,https://www.facebook.com/hillaryclinton/photos/a.889773484412515.1073741828.889307941125736/1309604815762711/?type=3,2016-11-02 13:13:33,136940,9299,18401,124658,9844,137,1916,35,350
889307941125736_1309197902470069,"When you're 27 million strong, no one can tell you that you don't belong. hillaryclinton.com/makeaplan",,video,https://www.facebook.com/hillaryclinton/videos/1309197902470069/,2016-11-02 08:52:16,20187,4972,2663,17690,2136,30,191,15,125
889307941125736_1308543899202136,"A note from Hillary for America Campaign Manager Robby Mook. If you're with Hillary, donate now: hrc.io/2ec2HcJ

""As of this morning, the Washington Post-ABC News tracking poll has us down one point. As of yesterday, Trump's odds of winning had climbed to above 1-in-4, per Nate Silver's projections. And he seems to be making up ground in Florida, according to a whole slew of polls. The truth is that Trump has a real, viable path to 270 electoral votes.

We have a very small window of time left to try to deploy resources to our battleground states that it will take to guarantee a win. So I'm asking you: Can you be one of the people we need on Facebook to step up and chip in to our GOTV Fund today to try to make sure we prove this poll an outlier come Tuesday?

This is the most consequential election in our lifetimes. Even a dollar today shows that you're fighting for Hillary: hrc.io/2ec2HcJ

Thanks,
Robby""",,status,,2016-11-01 22:30:00,9610,7117,928,7968,610,71,379,384,198
889307941125736_1308204619236064,"""Today, on average, Latinas still make 54 cents for every dollar a white man makes. That's just totally unacceptable. As president, I'll fight to pass the Paycheck Fairness Act to provide women the tools they need to fight wage discrimination. I'll work to raise the minimum wage, because two-thirds of hourly wage workers are women, many of whom have to try to support their families on far too little. And I'll promote pay transparency across our economy so that women have the information they need to negotiate fairly. This is a justice issue, an economic issue, and a family issue that needs to be addressed.""  —Hillary Clinton on equal pay.",Timeline Photos,photo,https://www.facebook.com/hillaryclinton/photos/a.889773484412515.1073741828.889307941125736/1308204619236064/?type=3,2016-11-01 17:31:23,11027,4579,1469,9479,761,88,92,106,501
889307941125736_1307959855927207,"Election Day is in one week—and once it's over, it can't be redone. Is everyone you know voting? RT this. hillaryclinton.com/makeaplan",media.giphy.com,link,https://media.giphy.com/media/3o7TKt7vNr4b3P0sJq/source.gif,2016-11-01 16:00:38,8853,3526,1539,7975,676,13,117,2,70
889307941125736_1307771352612724,"One week to go.

Watch Hillary talk about what's at stake for women in this election on the trail in Florida ↓",,video,https://www.facebook.com/hillaryclinton/videos/1307771352612724/,2016-11-01 14:41:13,96777,106038,9507,61245,25158,476,1069,337,8492
889307941125736_1307604312629428,Quedan solo 7 días para la elección. Preguntémonos: ¿Qué clase de país queremos dejarle a nuestra familia y a nuestros niños?: VoyaVotar2016.com,Timeline Photos,photo,https://www.facebook.com/hillaryclinton/photos/a.889773484412515.1073741828.889307941125736/1307604312629428/?type=3,2016-11-01 12:50:53,34022,5437,2039,30994,2565,50,223,12,178
889307941125736_1307351499321376,"After his lawyers advised against it, Trump used a ""legally dubious"" strategy to avoid paying taxes for years.",Donald Trump Used Legally Dubious Method to Avoid Paying Taxes,link,http://www.nytimes.com/2016/11/01/us/politics/donald-trump-tax.html?_r=2,2016-11-01 10:30:01,15594,5548,2640,10791,158,726,285,113,3521
889307941125736_1306820212707838,"""The thought of Donald Trump with nuclear weapons scares me to death. It should scare everyone."" —Bruce Blair, former nuclear weapons launch officer",,video,https://www.facebook.com/hillaryclinton/videos/1306820212707838/,2016-10-31 22:02:05,20705,6473,6142,18274,812,958,168,178,315
889307941125736_1306477179408808,It's time for Trump to answer serious questions about his ties to Russia. http://slate.me/2dWggCd,Timeline Photos,photo,https://www.facebook.com/hillaryclinton/photos/a.889773484412515.1073741828.889307941125736/1306477179408808/?type=3,2016-10-31 18:33:13,46903,9982,23481,34401,579,4752,928,144,6099
889307941125736_1306282039428322,"If you need a real scare this Halloween, just remember: Donald Trump could be elected president in just eight days. IWillVote.com",15 real-life headlines about Donald Trump that'll scare you more than anything else this Halloween,link,http://hrc.io/2f6wntU,2016-10-31 16:54:22,28379,5700,3949,20490,465,2144,3737,567,976
889307941125736_1306126309443895,FBI Director Comey—who released a vague and misleading letter about Hillary's emails just days before the election—opposed releasing details about Russian interference because he thought it was too close to the election. Incredible.,"FBI's Comey opposed naming Russians, citing election timing: Source",link,http://www.cnbc.com/2016/10/31/fbis-comey-opposed-naming-russians-citing-election-timing-source.html,2016-10-31 15:06:02,44314,9079,12850,22475,289,4015,556,324,16655
889307941125736_1305929919463534,"After their hard-fought primary battle in 2008, President Obama asked Hillary to serve as his secretary of state. Here's what foreign policy experts and world leaders think about her four years as America's chief diplomat:",,video,https://www.facebook.com/hillaryclinton/videos/1305929919463534/,2016-10-31 12:57:55,19475,4400,5544,16727,2317,48,141,6,236
889307941125736_1305653596157833,"""The fear of nuclear war that we had as children, I never thought our children would ever have to deal with that again.""",,video,https://www.facebook.com/hillaryclinton/videos/1305653596157833/,2016-10-31 09:41:35,25221,4873,9941,21453,1123,395,113,1741,396
889307941125736_1304840416239151,"Fighting for kids in foster care has been one of the causes of Hillary's career, all the way back to her days in law school.",Hillary Clinton's bipartisan effort in 1997 gave thousands of adopted kids a new home.,link,http://hrc.io/2e2ybC6,2016-10-31 07:00:01,31013,4971,3805,27794,2775,48,277,9,110
889307941125736_1304838832905976,"""Hillary will be a president our kids can look up to, a president who believes in our kids and will fight for them every day."" —First Lady Michelle Obama",,video,https://www.facebook.com/hillaryclinton/videos/1304838832905976/,2016-10-30 22:30:00,79691,9336,11237,69741,8138,123,1177,45,467
889307941125736_1304837766239416,"We've made extraordinary progress under President Obama. On November 8, that progress is on the ballot.",We've had 8 years of progress under President Obama. Here's how Hillary Clinton will build on it.,link,http://hrc.io/2e2B59V,2016-10-30 21:00:00,43513,6059,3039,39203,3283,82,650,26,269
889307941125736_1304835162906343,"""We don't miss voting in my family."" A story from the 1992 presidential campaign that President Bill Clinton will never forget:",,video,https://www.facebook.com/hillaryclinton/videos/1304835162906343/,2016-10-30 19:29:00,16967,3746,2534,15044,1585,36,192,13,97
889307941125736_1304766839579842,"If you're voting for Hillary, don't stop there. We need to support Democrats down the ticket to make her vision for America a reality.",Take a look at these maps: The presidential race isn't the only election that matters this year.,link,http://hrc.io/2fuoTnI,2016-10-30 18:00:30,27579,4953,1817,25355,1693,60,338,12,121
889307941125736_1304637902926069,"In 9 days, we'll choose who succeeds President Obama in the Oval Office. Make sure we make the right choice: IWillVote.com",Timeline Photos,photo,https://www.facebook.com/hillaryclinton/photos/a.889773484412515.1073741828.889307941125736/1304637902926069/?type=3,2016-10-30 17:01:23,25503,4578,1014,23021,2067,42,250,23,100
889307941125736_1304505139606012,"On Sunday, nearly a billion Hindus, Jains, Sikhs, and Buddhists around the world—including more than two million Americans—will celebrate Diwali, the festival of lights. For members of these faiths, lighting the lamp (the diya) is a reminder that light prevails over darkness, knowledge over ignorance, and good over evil.

Here in the United States, it is a tribute to the Indian American community that Diwali is celebrated with such beauty and joy. Regardless of our personal faith, Diwali reminds us that diversity is one of our greatest strengths as a nation, that light prevails over darkness, and that dharma—righteousness or goodness—must guide us toward a better tomorrow. If I have the honor of serving as president, I will be committed to building an Administration that reflects such diversity, including continuing White House celebrations of Diwali.

To those of you celebrating this joyous occasion, I wish you and your loved ones a Happy Diwali and Saal Mubarak.",,status,,2016-10-30 15:31:45,41651,4134,2933,37267,4034,158,80,11,101
889307941125736_1304343769622149,Who are you fighting for? Donate in their honor to help Hillary win: hrc.io/2eJAFJD,Donate to Hillary in honor of someone in your life.,link,http://hrc.io/2eJAFJD,2016-10-30 13:43:16,14124,4679,726,12713,992,21,283,6,109
889307941125736_1304203499636176,"On Friday, FBI Director James Comey bowed to partisan pressure and released a vague and inappropriate letter to Congress that only serves to give Republicans a new line of attack against Hillary. Here's what we've learned from news reports: The emails may not have been to or from Hillary. The emails weren't even ever on her server. The FBI case has not been re-opened.

HFA Press Secretary Brian Fallon breaks it down.",,video,https://www.facebook.com/hillaryclinton/videos/1304203499636176/,2016-10-30 11:32:52,42390,9994,17093,34623,2008,408,676,159,4516
889307941125736_1304100529646473,"Education is at stake.  
The environment is at stake.  
LGBT equality are at stake.  
Equal pay is at stake. 
IWillVote.com",,video,https://www.facebook.com/hillaryclinton/videos/1304100529646473/,2016-10-30 10:15:00,50354,6262,6037,44685,4906,73,433,19,238
889307941125736_1304096489646877,Trump has a history of boasting about his donations to charity—and little history of seriously donating to charity.,Trump boasts about his philanthropy. But his giving falls short of his words.,link,https://www.washingtonpost.com/politics/trump-boasts-of-his-philanthropy-but-his-giving-falls-short-of-his-words/2016/10/29/b3c03106-9ac7-11e6-a0ed-ab0774c1eaa5_story.html,2016-10-30 09:30:49,10978,3335,1327,9267,283,128,524,85,691
