status_id,status_message,link_name,status_type,status_link,status_published,num_reactions,num_comments,num_shares,num_likes,num_loves,num_wows,num_hahas,num_sads,num_angrys
889307941125736_1303389749717551,"With just days to go until the election, Republicans are pulling out all the stops to try to bring Hillary down. Share this to help set the record straight and get out the facts.",Timeline Photos,photo,https://www.facebook.com/hillaryclinton/photos/a.889773484412515.1073741828.889307941125736/1303389749717551/?type=3,2016-10-29 20:00:00,87454,16114,52659,79003,4406,467,2379,153,1046
889307941125736_1303309199725606,"A note on Director Comey's letter, from Hillary for America Chair John Podesta. Chip in now to say you're standing with Hillary: hrc.io/donatenow

""By now, you've probably heard some news about a bewildering letter sent to Congressional leaders by the Director of the FBI. This is all a bit confusing, and much of the reporting has been misleading or downright inaccurate, so I want to take a minute to walk through this. 

Here's the quick backstory: In July, FBI Director Jim Comey concluded a year-long investigation by deciding not to go forward with any case about Hillary's emails. It wasn't even a close call, he said. In his words, 'no reasonable prosecutor' would have brought charges.

Yesterday, in a surprise to us all, Comey wrote a very strange letter to Congress that was long on innuendo and short on facts. He said that in a completely separate investigation, the FBI had found some emails that may or may not be related to Hillary, and indeed may or may not be significant at all.

It's being reported that Comey sent this letter over the objections of Department of Justice officials who told him that it was inconsistent with longstanding policy of both Democratic and Republican administrations not to take action that might impact an election. It's an unprecedented intrusion into a close presidential election with less than 11 days until Election Day.
 
Voters deserve answers.

Comey needs to come clean with the American people about what he found and answer all the questions about why he took this unprecedented step less than weeks before the election.

Here's what this changes for you and this campaign: Absolutely nothing.

The facts be damned—Trump's always shown a complete disregard for the truth. In spite of there being no new information, he's already raising money off the bizarre letter (he literally sent a text message asking for money within an hour of the story breaking!) and he's more fired up than ever on the trail today.

These are the actions of a desperate man. Trump knows he can't win on his character, temperament, or his policies. He's behind, so he'll cling to whatever he can. We can't let him get away with this.

Our organizers and volunteers on the ground are rallying behind Hillary in what will be the biggest volunteer weekend of the campaign so far. You need to have her back, too. You need to say you're not willing to let Trump bully or buy his way into the presidency, and you're not going to let anything stop us from making history.

There are ten days to go. Let's buckle down, stay focused, and win this. Chip in here: hrc.io/donatenow""",,status,,2016-10-29 18:38:01,40082,8742,4396,35735,3174,122,677,63,311
889307941125736_1303213769735149,"""I want you hustling all the way until the polls close on November 8."" —President Obama hillaryclinton.com/gotv",,video,https://www.facebook.com/hillaryclinton/videos/1303213769735149/,2016-10-29 17:37:52,38387,5430,4536,33446,4091,72,215,15,548
889307941125736_1303114109745115,"""There's a longstanding policy of not doing anything that could influence an election. Those guidelines exist for a reason. Sometimes that makes for hard decisions. But bypassing them has consequences."" —George J. Terwilliger III, deputy attorney general under President George H.W. Bush",Justice Dept. Strongly Discouraged Comey on Move in Clinton Email Case,link,http://www.nytimes.com/2016/10/30/us/politics/comey-clinton-email-justice.html?ref=politics&_r=0,2016-10-29 16:29:02,24604,6733,3234,20005,711,264,276,117,3231
889307941125736_1302979746425218,"""The Director owes it to the American people to immediately provide the full details of what he is now examining.""",Justice officials warned FBI that Comey's decision to update Congress was not consistent with department policy,link,https://www.washingtonpost.com/world/national-security/justice-officials-warned-fbi-that-comeys-decision-to-update-congress-was-not-consistent-with-department-policy/2016/10/29/cb179254-9de7-11e6-b3c9-f662adaa0048_story.html,2016-10-29 14:32:03,42915,8866,4998,36965,1219,262,441,118,3910
889307941125736_1302182816504911,"Equality is on the ballot.
Justice is on the ballot.
Our progress is on the ballot. 
IWillVote.com",,video,https://www.facebook.com/hillaryclinton/videos/1302182816504911/,2016-10-29 08:00:00,29924,6048,4592,26591,2722,57,348,11,195
889307941125736_1301771556546037,"""Just kiss. I don't even wait. I sort of get away with things like that."" —Donald Trump",,video,https://www.facebook.com/hillaryclinton/videos/1301771556546037/,2016-10-28 15:14:00,16336,9512,4673,10324,197,632,292,267,4624
889307941125736_1301575466565646,"When Elizabeth Warren isn't busy holding special interests accountable, she finds the time to make some calls for Hillary. Join her: hillaryclinton.com/calls",Timeline Photos,photo,https://www.facebook.com/hillaryclinton/photos/a.889773484412515.1073741828.889307941125736/1301575466565646/?type=3,2016-10-28 11:16:45,26199,6878,1036,23396,2126,70,387,11,209
889307941125736_1301347273255132,"""Kids and families have been the passion of my life—and they'll be the heart of my presidency.""",,video,https://www.facebook.com/hillaryclinton/videos/1301347273255132/,2016-10-28 08:30:00,27295,5529,3199,23835,2865,65,343,18,169
889307941125736_1301347133255146,"""First ladies, we rock."" —First Lady Michelle Obama

Get all the highlights from Michelle and Hillary's first-ever joint rally: hrc.io/2fmCZY8",10 best moments from Michelle Obama and Hillary Clinton's first rally together.,link,http://hrc.io/2fmCZY8,2016-10-28 06:57:11,41863,4641,2294,37191,3993,108,367,16,188
