status_id,status_message,link_name,status_type,status_link,status_published,num_reactions,num_comments,num_shares,num_likes,num_loves,num_wows,num_hahas,num_sads,num_angrys
426895610773497_1227708337358883,"An IAS officer of the 2013 batch, 35-year-old Jitendra Gupta faced the ugly side of the system very early in his career.

Dr Gupta dared to take on the infamous and powerful Entry Mafia of Bihar. For his efforts, the Mafia filed a false corruption case against him, had his house unlawfully raided, and had him imprisoned for a month – all for raising his voice against injustice.

The Patna High Court, the Supreme Court, and the IAS Officers Association rushed to rescue Dr Gupta and get him bailed. Yesterday, the state government also dropped the frivolous charges against Dr Gupta. 

Despite the unfairness and threats he faced, Jitendra Gupta is continuing his crusade against Bihar's Entry Mafia.

""I joined the Indian Administrative Service to bring systemic reforms and serve society,"" Jitendra Gupta told The Logical Indian recently. ""This service seriously provides a very large platform to bring positive changes in the lives of millions of poor and needy. Neither is my case the first one nor will it be the last one.""

""Those willing to fight corruption must be ready to face such things. Though such incidents of harassment and victimisation disturb for a while but there are good people within the service and other institutions who come forward to protect you from such vested interests. If you are right, you need not worry.""

We salute the integrity and hard work of civil servants like Jitendra Gupta. People like him give us hope that our country will one day be rid of goons like the Entry Mafia so that we can build a better society where unlawful raids and imprisoning innocents will be a thing of the past.",Timeline Photos,photo,https://www.facebook.com/logical.indian/photos/a.430765593719832.1073741828.426895610773497/1227708337358883/?type=3,2017-04-25 08:15:00,2768,54,583,2415,98,16,0,59,180
426895610773497_1227699014026482,Muhammad Zia-ul-Haq was a dictator who plunged his country into religious fundamentalism. Read more about him here.,The dictator who ruled Pakistan for 11 years and imposed sharia and blasphemy laws,link,https://thelogicalindian.com/rewind/sharia/,2017-04-25 07:35:41,1408,115,142,1116,13,10,74,24,171
426895610773497_1227617107368006,"A software professional, she has set up 100 bird shelters and is rearing 350 butterflies in her apartment balcony in Mumbai.",Meet The Mumbaikar Who Has Set Up 100 Bird Shelters & Rears 350 Butterflies In Her Apartment,link,https://thelogicalindian.com/story-feed/exclusive/bird-shelters/,2017-04-25 06:23:15,13822,118,1323,12618,734,461,8,1,0
426895610773497_1227506640712386,"25 CRPF Jawans who attained martyrdom in #Sukma Maoist attack in Bastar.

The Logical Indian community salutes these heroes and our heartfelt condolences to the family of the martyrs.",Photos from The Logical Indian's post,photo,https://www.facebook.com/logical.indian/photos/a.430765593719832.1073741828.426895610773497/1227505787379138/?type=3,2017-04-25 04:02:01,5451,138,595,3571,164,3,2,1657,54
426895610773497_1227377740725276,"49 security forces have been killed in 2017 by Maoists in Chhattishgarh, which is higher than the five-year average.",25 CRPF Personnel Killed In Deadliest Naxal Attack In Years,link,https://thelogicalindian.com/news/crpf-killed/,2017-04-25 01:11:23,2043,106,229,942,5,7,3,611,475
426895610773497_1227357224060661,"Via ~ Sports Possible.
THIS IS A WORLD LEADING THROW. Manpreet has surpassed USA's Michelle Carter whose best throw this season was 18.54m recorded on April 15.",Timeline Photos,photo,https://www.facebook.com/logical.indian/photos/a.430765593719832.1073741828.426895610773497/1227357224060661/?type=3,2017-04-25 00:39:37,17466,47,1489,16002,489,956,14,4,1
426895610773497_1227310350732015,"Religious fanatics are so blinded that they are ready to kill anyone over religious issues. The turn of events in Pakistan must be taken as a lesson by us.

#BolneDo","After A Mob Lynched A Student For Alleged ""Blasphemy"", Pakistan's Youth Demand Change In Blasphemy Laws",link,https://thelogicalindian.com/news/blasphemy-laws/,2017-04-25 00:03:45,1527,64,148,1337,10,2,4,122,52
426895610773497_1226655524130831,A lot of rumours are being circulated to malign the farmers. This article answers the questions raised - including why the farmers were protesting at Jantar Mantar and not in Tamil Nadu.,Tamil Nadu Farmers Call Off Protest Till May 25 After Chief Minister's Promise,link,https://thelogicalindian.com/news/tamil-nadu-farmer-protest/,2017-04-24 16:30:00,372,12,69,344,12,0,9,6,1
426895610773497_1226654847464232,"Know about the new guidelines issued by the government on paying the service charge while dining in a restaurant or hotel.

Via - Factly","Government Issues New Guidelines On Service Charge In Hotels, But Doubts Still Remain",link,https://thelogicalindian.com/story-feed/awareness/new-guidelines-on-service-charge/,2017-04-24 13:40:00,676,27,125,644,11,3,15,0,3
426895610773497_1226335010829549,"There is no correlation between knowing English and knowledge, much less between English and character.
Irrfan Hindi Medium","Hindi Medium Or English Medium, Your Character Or Intelligence Are Not Dependent On Your Language",link,https://thelogicalindian.com/story-feed/opinion/hindi-medium/,2017-04-24 10:00:00,3812,72,413,3655,146,9,2,0,0
426895610773497_1226317574164626,"Know about the new guidelines issued by the government on paying the service charge while dining in a restaurant or hotel.

Via - Factly","Government Issues New Guidelines On Service Charge In Hotels, But Doubts Still Remain",link,https://thelogicalindian.com/story-feed/awareness/new-guidelines-on-service-charge/,2017-04-24 09:30:00,1366,61,439,1273,6,16,51,6,14
426895610773497_1226332550829795,"Good evening, Logical Indians!

Secularism is one of the most important components of democracy. The Preamble to the Constitution asserts that India is a secular nation, and India has no concept of a state/national religion. While most of us agree that secularism is compulsory for a healthy democracy, each of us tends to have a different understanding of secularism.

According to you, what is secularism?

#LetsTalk",,status,,2017-04-24 09:00:00,354,247,9,338,7,1,8,0,0
426895610773497_1226085094187874,"But what else can they do? ""All migrants are like stray dogs,"" she says, ""filling their hunger by wandering in the streets. You have to work till your blood turns black."" 

Via - People's Archive of Rural India",'All Migrants Are Like Stray Dogs',link,https://thelogicalindian.com/story-feed/awareness/migrants/,2017-04-24 03:30:00,352,12,26,218,2,2,1,121,8
426895610773497_1226074660855584,"Via ~ Sports Possible
Participation, not racing the clock, is the priority for Kaur, who has been dubbed the ""miracle from Chandigarh"" in New Zealand media. Kaur was the only participant in the 100-years-and-over category at the New Zealand event, which attracted 25,000 competitors and clocked 1 minute and 14 seconds to bag her 17th gold medal.",Timeline Photos,photo,https://www.facebook.com/logical.indian/photos/a.430765593719832.1073741828.426895610773497/1226074660855584/?type=3,2017-04-24 03:06:15,3117,17,272,2872,106,134,5,0,0
426895610773497_1226033170859733,She came to Bengaluru to start her new life with her family. Once she saw few children in dishevelled condition playing in the cement that made her realise how privileged she was and she decided to do something for these children.,This Software Engineer Left Her Job To Open A School For The Children Of Construction Workers,link,https://thelogicalindian.com/story-feed/exclusive/a-school-for-children-of-construction-workers/,2017-04-24 02:01:53,4469,55,478,4174,196,95,4,0,0
426895610773497_1227596817370035,"We all love fairytales. And we love real-life fairytales even more. And what do you get when you mix 20 hard-working Indian women, crowdfunding, public generosity, and ice hockey? A fairytale unlike any other.

This is the story of the Indian Ice Hockey team.

From self-funded beginnings and practicing on a natural frozen pond to scripting their first international win, these girls have made each and every Indian proud with their hard work, dedication, and successes. 

Stay tuned for the trailer, out tomorrow on The Logical Indian. Coming soon on the big screen.",Cover Photos,photo,https://www.facebook.com/logical.indian/photos/a.430172850445773.1073741827.426895610773497/1226332127496504/?type=3,2017-04-24 08:28:00,127,4,12,115,12,0,0,0,0
426895610773497_1225993407530376,"Via ~ Sports Possible
The Indian Ice Hockey team don't have much of a fan-following, but the sport is definitely growing with every passing day. Led by Tsewang Dorjey from the Ladakh Scouts Regiment, the team scripted their second-ever international win at the ongoing Challenge Cup of Asia in Kuwait. Five years back, India defeated Macau by a score of 5-1, which happened to be the country's first every victory in this sport.",Timeline Photos,photo,https://www.facebook.com/logical.indian/photos/a.430765593719832.1073741828.426895610773497/1225993407530376/?type=3,2017-04-24 01:15:11,2006,13,98,1923,59,23,1,0,0
426895610773497_1225983790864671,A lot of rumours are being circulated to malign the farmers. This article answers the questions raised - including why the farmers were protesting at Jantar Mantar and not in Tamil Nadu.,Tamil Nadu Farmers Call Off Protest Till May 25 After Chief Minister's Promise,link,https://thelogicalindian.com/news/tamil-nadu-farmer-protest/,2017-04-24 00:54:04,1938,150,386,1762,19,2,38,104,13
426895610773497_1224090581053992,Know about the law and how admins can ensure they are not jailed if someone spreads wrong information.,Admins Of Facebook & WhatsApp Groups Can Be Jailed For Fake News & Offensive Posts In Their Groups,link,https://thelogicalindian.com/news/facebook-whatsapp-fake-news-group/,2017-04-23 10:30:00,965,76,266,840,23,11,85,3,3
426895610773497_1224090031054047,The National Green Tribunal's verdict is welcome. It is crucial that the authorities follow up within the stipulated time before the pollution causes a serious threat to the lives of the residents of the area.,"Bengaluru: In A Welcome Move, NGT Orders Immediate Shut Down Of Industries Around Bellandur Lake",link,https://thelogicalindian.com/news/bellandur-lake/,2017-04-23 09:30:00,658,22,85,621,28,6,2,1,0
426895610773497_1225015520961498,"Farmer protest day 41  Dr. Kumar Vishwas joins the protest. 
Youth dropped at Jantar Mantar by the police. 
Local farmers join in. 
Ask your questions in the comment section for us to take them to the protesters for answers.",,video,https://www.facebook.com/logical.indian/videos/1225015520961498/,2017-04-23 06:45:34,1772,649,328,1383,49,7,9,209,115
426895610773497_1224728504323533,"Day- 41st of the Tamil Farmers' Protest

Tamil Youth Forum Delhi is marching to show their support to the protesting farmers from India Gate to Jantar Mantar. Yesterday farmers drank urine in protest before the police interrupted them. It is going bizarre every coming day. However, the center government hasn't approached them.  

You can ask your questions about the protest directly to the group and/or to the farmers. 
Put your questions in the comments section of the Live session. 
Going live Soon. 
Stay Tuned.",Photos from The Logical Indian's post,photo,https://www.facebook.com/logical.indian/photos/a.430765593719832.1073741828.426895610773497/1224727500990300/?type=3,2017-04-23 05:40:00,2103,219,430,1424,9,4,22,458,186
426895610773497_1224087411054309,"''Public transport operators refuse to let her board their vehicles. She is called 'filthy' because of her occupation as an informal waste picker.''

via - Video Volunteers",Invisible Eco-Warriors: Waste Pickers Who Keep Cities Clean But Face Discrimination,link,https://thelogicalindian.com/story-feed/awareness/waste-pickers/,2017-04-23 04:30:00,599,15,100,469,15,1,0,92,22
426895610773497_1222477494548634,The election is today. Know about the main candidates and how the result will affect India.,The 2017 French election: An inexperienced banker vs a female Donald Trump,link,https://thelogicalindian.com/story-feed/awareness/french-election-2017/,2017-04-22 23:30:00,656,37,43,589,1,9,55,1,1
426895610773497_1224079577721759,"Dr Jitendra Gupta continues to fight the powerful Entry Mafia of Bihar despite threats, unlawful raids, and having been jailed for a month under made-up charges.","This IAS Officer Took Action Against The Mafia, Was Arrested Under False Charges & Jailed Without Reason",link,https://thelogicalindian.com/story-feed/exclusive/ias-officer-jitendra-gupta/,2017-04-22 16:30:00,491,5,119,407,11,9,0,19,45
426895610773497_1224080524388331,She broke the taboo against widows when she finally took part in her youngest daughter's wedding.,"Barred Form Her Children's Marriage Three Times, A Widow Broke The Taboo The Fourth Time",link,https://thelogicalindian.com/story-feed/get-inspired/widow-broke-the-taboo/,2017-04-22 13:35:00,450,3,33,416,28,6,0,0,0
426895610773497_1223980627731654,"#EarthDay

The life giving process of menstruation needn't make Mother Earth a trash dump and it certainly needn't shame our girls and women.",Period Shaming – What We Ought To Do,link,https://thelogicalindian.com/story-feed/opinion/period-shaming/,2017-04-22 10:30:00,1313,18,139,1262,44,5,0,2,0
426895610773497_1222493364547047,"Good evening, Logical Indians!

Fake news is exploding in India, a country which has 50 million WhatsApp accounts and 200 million Facebook users. It is everywhere: created by propagandists and shared by impressionable people. And there are many instances where fake news has had real life consequences, leading to actual violence and people getting hurt. 

Fake news is dangerous to democracy. If information is corrupted, the national debate is diluted and democracy is weakened. The viral nature of fake news has established a culture of lies and misinformation which continues to grow unchecked.

What should be done to stop the spreading of fake news?

#LetsTalk",,status,,2017-04-22 09:30:00,1084,209,228,1017,3,2,5,30,27
426895610773497_1222475817882135,"Dr Jitendra Gupta continues to fight the powerful Entry Mafia of Bihar despite threats, unlawful raids, and having been jailed for a month under made-up charges.","This IAS officer fought the mafia, was arrested under false charges & jailed without reason",link,https://thelogicalindian.com/story-feed/exclusive/ias-officer-jitendra-gupta/,2017-04-22 07:00:00,4141,68,849,3337,56,36,7,274,431
426895610773497_1222466867883030,"Domestic violence was at the peak in the community, and it was of utmost importance to fix the learning gap and find measures to reduce domestic violence.",A Young Engineer Is Changing Lives Of Slum Children Through Community Leadership Programmes,link,https://thelogicalindian.com/my-social-responsibility/community-leadership-programmes/,2017-04-22 04:00:00,685,6,53,658,16,11,0,0,0
426895610773497_1223509624445421,"Day 40 Tamil Farmers' Protest. Protesters go for Urine Protest and say they are reduced to such a level that they have to drink urine. 

To know about the protest and farmers' issues and ask questions directly to them stay tuned. 

Going LIVE soon.",Untitled Album,photo,https://www.facebook.com/logical.indian/photos/a.782317798564608.1073741853.426895610773497/1223509624445421/?type=3,2017-04-22 01:11:46,4544,180,913,2846,2,7,26,1251,412
426895610773497_1222454071217643,She broke the taboo against widows when she finally took part in her youngest daughter's wedding.,"Barred Form Her Children's Marriage Three Times, A Widow Broke The Taboo The Fourth Time",link,https://thelogicalindian.com/story-feed/get-inspired/widow-broke-the-taboo/,2017-04-22 00:30:00,3853,41,230,3561,249,36,1,4,2
426895610773497_1222490834547300,Know about the law and how admins can ensure they are not jailed if someone spreads wrong information.,Admins Of Facebook & WhatsApp Groups Can Be Jailed For Fake News & Offensive Posts In Their Groups,link,https://thelogicalindian.com/news/facebook-whatsapp-fake-news-group/,2017-04-21 14:30:00,715,42,177,603,15,7,84,1,5
426895610773497_1222389327890784,"Few countries have had as eventful a history as Cambodia. The South-east Asian country has known prosperity, genocide, dictatorship, and recovery - and all in the span of the last century. The Khmer Rouge, the ultra-nationalist and ultra-violent faction of the Cambodian Communist Party, perpetrated a reign of terror in the country for decades. Through their secret forces, killing fields, and disastrous agrarian policies, the Khmer Rouge killed over 3 million people. Today, Cambodia is struggling to move on from its past, and it is doing so successfully. Though the road is long, the future looks bright for the Cambodian people.",The Adventures of Arjuna & Bheema,video,https://www.facebook.com/logical.indian/videos/1222389327890784/,2017-04-21 13:35:00,143,5,31,126,9,2,0,6,0
426895610773497_1222493684547015,A Government School teacher from Tamil Nadu sold her jewellery to give world-class classroom and education to her students. And she and her students got appreciation from all across the world. Know about her #In2Minutes.,Teacher Who Sold Her Jewelry For Her Students.,video,https://www.facebook.com/logical.indian/videos/1222493684547015/,2017-04-21 11:30:00,45435,978,52942,40174,3315,1841,27,57,21
426895610773497_1222634447866272,"""We will resort to eating our own faeces and drink our own urine,"" said the farmers, adding that the protests will continue until their death.",Day 40 Of Farmers' Protest: Prashant Bhushan Extends Support To Tamil Nadu Farmers,link,https://thelogicalindian.com/story-feed/awareness/prashant-bhushan-extends-support-to-tamil-nadu-farmers/,2017-04-21 10:30:00,3735,107,591,2964,30,7,16,565,153
426895610773497_1222637467865970,"#LetsTalk

Good evening, Logical Indians!

In one of the worst road accidents, a bus carrying at least 47 passengers fell into a river in Himachal Pradesh on Wednesday, killing at least 45 people. 

The driver and conductor knew about the vehicle's technical glitch, but kept driving, fearing that the passengers might ask for a ticket refund or a different mode of transportation. 

Despite the state authorities' plans to put up barricades on the sides of sharp road bends, no development had taken place in the last 10 years by both Congress and BJP. 

Road accidents in hilly areas are common with 4,488 accidents occurring in Himachal alone in the last 6 years. Overloading, no regular vehicle check-ups, drinking and driving, poor road infrastructure, and speeding in hilly areas are the primary reasons for such accidents. 

When nearly 50 people die in a road accident, who should be held responsible? The government or the driver of the vehicle?",,status,,2017-04-21 09:55:32,382,54,18,222,1,1,0,91,67
426895610773497_1222507331212317,"Have a look at the good discipline of respected drivers of Sikkim. 

A visual from Deorali in East Sikkim.
Photo courtesy: Ganesh Sharma

Via- Sikkim Messenger",Timeline Photos,photo,https://www.facebook.com/logical.indian/photos/a.430765593719832.1073741828.426895610773497/1222507331212317/?type=3,2017-04-21 08:21:36,62963,1083,10919,57863,2290,2712,90,4,4
426895610773497_1222319677897749,"Civil Services Day is celebrated on 21 April every year.

It was on this day in 1947 that Sardar Vallabh Bhai Patel addressed the first batch of civil servants.  He referred to civil servants as the ""steel frame of India"" and advised civil servants to be impartial, incorruptible, and apolitical. 

The values of integrity, impartiality, and merit remain the guiding principles of Indian civil services. There are around 50,000 civil servants in India today, and together they constitute the permanent executive branch of India and the backbone of the administrative machinery of the country.",Timeline Photos,photo,https://www.facebook.com/logical.indian/photos/a.430765593719832.1073741828.426895610773497/1222319677897749/?type=3,2017-04-21 05:54:11,1410,22,174,1355,41,1,13,0,0
426895610773497_1222181644578219,"45 villagers including 22 women are in jail. The court has granted them bail for an amount of Rs 10,000 but they don't have the money.",Goa: 45 Villagers Are Stuck In Jail For The Last 10 Days For Protesting Against Mining,link,https://thelogicalindian.com/story-feed/exclusive/goa-villagers-jail/,2017-04-21 05:06:06,2881,84,1240,1481,5,13,6,522,854
426895610773497_1222223824574001,"Via ~ Sports Possible

Five karate players from Gurugram have made India proud as the country scooped three gold, two silver and six bronze medals at the US Open Karate Championship in Las Vegas, which was held from April 12 to 16. The prestigious annual Karate event saw a participation of 2374 players from 42 countries. The Indian team, led by Sensei Yashpal Singh Kalsi, a world-renowned martial artist from Gurugram, won a total of 11 medals. (Source: ANI)",Timeline Photos,photo,https://www.facebook.com/logical.indian/photos/a.430765593719832.1073741828.426895610773497/1222223824574001/?type=3,2017-04-21 04:31:55,3157,24,250,3004,79,72,1,1,0
426895610773497_1222180574578326,Know about the law and how admins can ensure they are not jailed if someone spreads wrong information.,Admins Of Facebook & WhatsApp Groups Can Be Jailed For Fake News & Offensive Posts In Their Groups,link,https://thelogicalindian.com/news/facebook-whatsapp-fake-news-group/,2017-04-21 03:29:05,4041,241,1046,3325,107,51,523,11,24
426895610773497_1222071064589277,"Via ~ Sports Possible.
But Gopi is never satisfied. You win a game… Well done. Move ahead and improve yourself further to bring even more victories in the future.","Indian Shuttlers Grabbed 8 Medals Last Week, Thanks To Gopichand",link,https://thelogicalindian.com/story-feed/sports/gopichand/,2017-04-21 02:00:00,1409,5,56,1356,39,14,0,0,0
426895610773497_1222047871258263,"State authorities' neglect, carelessness from owners & bus drivers, and passengers not demanding to stop the bus resulted in a horrific accident costing many lives.",At Least 45 People Died As A Bus Plunges Into A River In Himachal Pradesh,link,https://thelogicalindian.com/news/bus-plunges-into-river-in-himachal-pradesh/,2017-04-21 00:49:35,1796,54,84,1022,11,8,3,664,88
426895610773497_1221513184645065,"By aligning yourself unquestionably to one politician – or political party – you narrow your worldview, strengthen your echo chambers, and see politics and patriotism as a question of ""us vs. them"".","Politicians Should Be Treated With Caution, Not Worshipped Like Gods",link,https://thelogicalindian.com/story-feed/opinion/hero-worship-of-politicians/,2017-04-20 16:30:00,1130,32,283,1042,33,3,45,2,5
426895610773497_1221512764645107,The National Green Tribunal's verdict is welcome. It is crucial that the authorities follow up within the stipulated time before the pollution causes a serious threat to the lives of the residents of the area.,"Bengaluru: In A Welcome Move, NGT Orders Immediate Shut Down Of Industries Around Bellandur Lake",link,https://thelogicalindian.com/news/bellandur-lake/,2017-04-20 15:30:00,241,3,18,223,10,5,1,2,0
426895610773497_1221149168014800,"By aligning yourself unquestionably to one politician – or political party – you narrow your worldview, strengthen your echo chambers, and see politics and patriotism as a question of ""us vs. them"".","Politicians Should Be Treated With Caution, Not Worshipped Like Gods",link,https://thelogicalindian.com/story-feed/opinion/hero-worship-of-politicians/,2017-04-20 10:30:00,3809,117,852,3479,137,8,58,8,119
426895610773497_1221171514679232,The election is in two days. Know about the main candidates and how the result will affect India.,The 2017 French election: An inexperienced banker vs a female Donald Trump,link,https://thelogicalindian.com/story-feed/awareness/french-election-2017/,2017-04-20 09:30:00,828,66,52,683,10,7,121,4,3
426895610773497_1221223094674074,"#LetsTalk 
Good Evening, Community Members! 

In a 2006 judgement, the Supreme Court had directed the central and state governments to comply with a set of seven directives to make the police force more people-centric than ruler-centric. Setting up a police complaints authority for public complaints against police misconduct, and setting up a police establishment board to decide on transfers, postings and promotions, were some of its provisions. 

In 2014, Prime Minister Narendra Modi also called for the making of SMART police - Sensitive, Mobile, Alert, Reliable and Techno-savvy.

11 years after the Supreme court order, do we see police as a sign of relief or trouble? Can we go to a police station and register a complaint without fear or ""money""? 

If not, then what measures do you think that the central and state governments should take to implement 7 directives of the Supreme court?",,status,,2017-04-20 09:15:00,119,32,9,113,1,1,1,2,1
426895610773497_1221142551348795,"Prashant Bhushan pays a visit to the protesting farmers. 
We will discuss the legality and legitimacy of their demands with him. As well as the PIL filed by him. 

Stay Tuned!",Timeline Photos,photo,https://www.facebook.com/logical.indian/photos/a.430765593719832.1073741828.426895610773497/1221142551348795/?type=3,2017-04-20 07:34:20,2099,63,114,1975,84,20,11,7,2
426895610773497_1221028141360236,"Via ~ Sports Possible

The competition starts in two days but the Indian teams are still not sure whether they would get their visas on time.",Visa Issues Disappoint Indian Athletes Participation In World Relay Championships And Asian Grand Prix,link,https://thelogicalindian.com/story-feed/sports/visa-issues-indian-athletes-participation/,2017-04-20 06:00:00,464,12,33,316,2,1,1,59,85
