status_id,status_message,link_name,status_type,status_link,status_published,num_reactions,num_comments,num_shares,num_likes,num_loves,num_wows,num_hahas,num_sads,num_angrys
426895610773497_1220959771367073,The National Green Tribunal's verdict is welcome. It is crucial that the authorities follow up within the stipulated time before the pollution causes a serious threat to the lives of the residents of the area.,"Bengaluru: In A Welcome Move, NGT Orders Immediate Shut Down Of Industries Around Bellandur Lake",link,https://thelogicalindian.com/news/bellandur-lake/,2017-04-20 04:12:22,2720,30,322,2547,110,45,4,7,7
426895610773497_1220959451367105,"Tamil Farmers have been on the protest for about 40 days now. The protesters are coming with bizarre ideas to get media and government attention. However, nothing has worked out till now. 
To show of apathy from the Government they did the impersonation of PM whipping the farmers recently. 
To know all about it and ask your questions directly to the farmers JOIN US. 
Going LIVE Soon!",Timeline Photos,photo,https://www.facebook.com/logical.indian/photos/a.430765593719832.1073741828.426895610773497/1220959451367105/?type=3,2017-04-20 04:11:49,2505,215,515,1767,10,11,20,472,225
426895610773497_1220790454717338,"Via ~ Sports Possible.
Congratulations Serena Williams. Soon to be a mother, and hopefully comeback story of the year next year.",Superwoman Serena Williams Was Pregnant When She Won Australian Open Without Dropping A Set,link,https://thelogicalindian.com/story-feed/sports/superwoman-serena-williams/,2017-04-20 01:00:00,3161,23,138,2797,137,225,1,1,0
426895610773497_1219960768133640,Supreme Court has exempted 6 categories of differentaly abled people from standing during national anthem in movie halls.,SC Exempts People With Disability From Standing For National Anthem In Movie Halls,link,https://thelogicalindian.com/news/standing-for-national-anthem/,2017-04-19 13:35:00,221,12,21,210,5,0,4,1,1
426895610773497_1219958431467207,"via ~ Sports Possible
Let's relive the glory of a woman whose name has gone down in history as one of the 'greatest Indian athletes' of all time.",A Leap To Glory: Long Jump Legend Anju Bobby George Turns 40,link,https://thelogicalindian.com/story-feed/sports/anju-bobby-george/,2017-04-19 10:00:00,3035,12,111,2941,74,20,0,0,0
426895610773497_1219754378154279,"These are images of the Warsaw Ghetto Uprising. Today in 1943, during World War II, the Warsaw Ghetto Uprising began.

The uprising was the largest revolt by Jews during the Holocaust. It took place in Warsaw, in Nazi-occupied Poland. The uprising opposed Nazi Germany's final effort to transport the remaining Ghetto (segregated areas for Jews and prisoners in Nazi-occupied Europe) population to the Treblinka death camp.

The uprising started on 19 April when the Ghetto refused to surrender to the police commander, who then ordered the burning of the Ghetto, block by block, ending on 16 May. The Jews were highly outnumbered and outgunned, and thus the Warsaw Ghetto Uprising failed. 

A total of 13,000 Jews died, about half of them burnt alive or suffocated (unofficial sources put the number of killed at above 50,000). German casualties were about 300. 

The Holocaust was a genocide during World War II in which some six million European Jews were killed by Adolf Hitler-led Nazi Germany and the Nazis' allies. The victims included 1.5 million children and represented about two-thirds of the continent's Jewish population. The Holocaust's victims also included prisoners of war, Gypsies, differently-abled people, communists, and homosexuals.",Timeline Photos,photo,https://www.facebook.com/logical.indian/photos/a.430765593719832.1073741828.426895610773497/1219754378154279/?type=3,2017-04-19 04:45:00,321,30,48,234,1,0,0,75,11
426895610773497_1219691188160598,"19 April 1975 marked a major milestone for ISRO - Indian Space Research Organisation. This was the day it launched India's first indigenous satellite, Aryabhata.

Aryabhata was built to conduct experiments in X-ray astronomy, aeronomics, and solar physics. The spacecraft was a 26-sided polyhedron 1.4 metres (4.6 ft) in diameter. All faces (except the top and bottom) were covered with solar cells.

The satellite returned to the Earth's atmosphere on 11 February 1992.

ISRO's beginnings were humble. Set up in 1962 by Jawaharlal Nehru and led by Dr Vikram Sarabhai, ISRO led India's space programme from its fund-starved early days to today being one of the world's most successful. 

The credit for the historic success story of our space programme goes entirely to our scientists, engineers, researchers, and others associated with ISRO. 42 years since Aryabhata's launch, ISRO's future seems ever so ambitious and ever so hopeful.",Timeline Photos,photo,https://www.facebook.com/logical.indian/photos/a.430765593719832.1073741828.426895610773497/1219691188160598/?type=3,2017-04-19 03:00:00,2222,15,342,2117,75,28,2,0,0
426895610773497_1219635011499549,"SBI Card, a subsidiary of SBI, on Tuesday announced that it will levy a charge of Rs 100 on cheque payments for bill amounts less than or equal to Rs 2000.","From This Month, SBI Card Users Need To Pay Rs 100 On Cheque Payments Less Than Rs 2000",link,https://thelogicalindian.com/story-feed/awareness/sbi-cheque-charges/,2017-04-19 02:30:00,3742,522,1276,1942,16,46,477,46,1215
426895610773497_1219565628173154,Supreme Court has exempted 6 categories of differentaly abled people from standing during national anthem in movie halls.,SC Exempts People With Disability From Standing For National Anthem In Movie Halls,link,https://thelogicalindian.com/news/standing-for-national-anthem/,2017-04-19 00:01:56,1761,127,110,1513,53,7,175,2,11
426895610773497_1219086928221024,"A loudspeaker cannot be used without written permission (between 10 pm and 6 am).

Know about the other laws.

Source: Factly",Rules Restricting The Use Of Loud Speakers At Religious Places Rarely Followed,link,https://thelogicalindian.com/story-feed/awareness/loud-speakers/,2017-04-18 15:00:00,582,24,121,546,20,7,4,1,4
426895610773497_1219086131554437,"Hindustan Unilever Limited (HUL) a consumer goods based company has dragged India's biggest dairy cooperative Amul (GCMMF), to the Bombay High Court.",The Hottest War In The Coolest Domain: Hindustan Unilever vs Amul,link,https://thelogicalindian.com/news/hindustan-unilever-amul/,2017-04-18 13:35:00,503,21,55,464,10,1,25,2,1
426895610773497_1218828894913494,"Few countries have had as eventful a history as Cambodia. The South-east Asian country has known prosperity, genocide, dictatorship, and recovery - and all in the span of the last century. The Khmer Rouge, the ultra-nationalist and ultra-violent faction of the Cambodian Communist Party, perpetrated a reign of terror in the country for decades. Through their secret forces, killing fields, and disastrous agrarian policies, the Khmer Rouge killed over 3 million people. Today, Cambodia is struggling to move on from its past, and it is doing so successfully. Though the road is long, the future looks bright for the Cambodian people.",The Adventures of Arjuna & Bheema,video,https://www.facebook.com/logical.indian/videos/1218828894913494/,2017-04-18 10:30:00,241,24,86,216,11,0,0,14,0
426895610773497_1218865434909840,"Stanford University's entrepreneurs (faculty and alumni) have started 39,900 companies, which in turn have created 5.4 million jobs and generated the US $2.7 trillion in annual revenues.","What India Can Learn From Stanford, The Catalyst For Silicon Valley's Success",link,https://thelogicalindian.com/story-feed/opinion/what-india-can-learn-from-stanford/,2017-04-18 09:30:00,2927,64,300,2685,70,161,9,2,0
426895610773497_1218639471599103,"According to reports, 35% of children in the first grade cannot recognise numbers from 1 – 9 & almost 50% of children in the fifth grade cannot read a second-grade-level textbook.",This IIM Graduate Is Bringing Quality Education To Rural Children In West Bengal's Govt Schools,link,https://thelogicalindian.com/my-social-responsibility/quality-earlyhood-education-govt-schools/,2017-04-18 09:00:00,1475,24,163,1399,50,21,2,2,1
426895610773497_1218747351588315,"Her marathon race in 1967 became historic when she became the first woman to complete the all-male race as registered participant, despite officials trying to force her off-track.","She Was The First Woman To Complete The Boston Marathon; 50 Years Later, She Ran Again",link,https://thelogicalindian.com/story-feed/get-inspired/boston-marathon/,2017-04-18 06:30:00,2722,7,94,2495,122,101,1,2,1
426895610773497_1218775571585493,"[Update: He has been granted bail by the court]

Business tycoon Vijay Mallya, accused of defaulting on loans worth crores, has been arrested in London and will be produced in a metropolitan court today.

India had in February asked the UK to extradite Mr Mallya, who is facing charges of money laundering and several warrants in the country. CBI sources count the arrest, which took place around 9.30 in the morning, as a big win in attempts to bring the liquor baron to justice.

The flamboyant entrepreneur left India a year ago amid attempts by a group of banks to recover around Rs. 9,000 crores in loans to his collapsed Kingfisher Airlines.

Information Source: NDTV",Timeline Photos,photo,https://www.facebook.com/logical.indian/photos/a.430765593719832.1073741828.426895610773497/1218775571585493/?type=3,2017-04-18 05:49:38,903,122,88,795,20,9,70,2,7
426895610773497_1218608428268874,"''Public transport operators refuse to let her board their vehicles. She is called 'filthy' because of her occupation as an informal waste picker.''

via - Video Volunteers",Invisible Eco-Warriors: Waste Pickers Who Keep Cities Clean But Face Discrimination,link,https://thelogicalindian.com/story-feed/awareness/waste-pickers/,2017-04-18 02:00:01,2132,23,398,1668,15,5,1,295,148
426895610773497_1218562158273501,"A loudspeaker cannot be used without written permission (between 10 pm and 6 am).

Know about the other laws. 

Source: Factly",Rules Restricting The Use Of Loud Speakers At Religious Places Rarely Followed,link,https://thelogicalindian.com/story-feed/awareness/loud-speakers/,2017-04-18 00:35:13,5782,210,1013,5380,142,31,161,21,47
426895610773497_1217738691689181,"Hindustan Unilever Limited (HUL) a consumer goods based company has dragged India's biggest dairy cooperative Amul (GCMMF), to the Bombay High Court.",The Hottest War In The Coolest Domain: Hindustan Unilever vs Amul,link,https://thelogicalindian.com/news/hindustan-unilever-amul/,2017-04-17 23:30:00,2629,124,443,2406,29,57,124,3,10
426895610773497_1217785875017796,The boy who freed thousands of working children before the age of 11 and then he was shot dead!,"22 Years Ago, He Was Murdered For Fighting Against Child Labour; Know About Him",link,https://thelogicalindian.com/story-feed/get-inspired/22-years-ago-he-was-murdered-for-fighting-against-child-labour-know-about-him/,2017-04-17 15:00:00,2392,21,474,1946,108,7,0,320,11
426895610773497_1217836441679406,"Good evening, Logical Indians!

IIT Kharagpur has announced that it will introduce basic courses in Vastu Shastra for architecture students from August 2017. More detailed courses will be available for post-graduate students. The move, officials say, is to ""balance"" architectural concepts, which have been primarily based on ""Western schools of thought"".

What do you think of this step by IIT Kharagpur?

#LetsTalk",,status,,2017-04-17 11:00:00,1939,387,90,1462,84,20,342,8,23
426895610773497_1217737741689276,"via ~ Sports Possible

Not just India but the world looks forward to welcoming the new star much like her beaming smile!",PV Sindhu: Consistency Is The Key For This Class Act!,link,https://thelogicalindian.com/story-feed/sports/sindhu/,2017-04-17 10:30:00,1572,6,31,1523,43,1,3,0,2
426895610773497_1217796801683370,"That's home, as seen from Saturn, 1.2 billion km away, from NASA's Mission to Saturn. On it is everyone you love, everyone you know, everyone you ever heard of.

Credits: NASA's Cassini Mission to Saturn and Beyond Our Sight",Timeline Photos,photo,https://www.facebook.com/logical.indian/photos/a.430765593719832.1073741828.426895610773497/1217796801683370/?type=3,2017-04-17 10:00:00,2750,69,340,2265,211,269,4,0,1
426895610773497_1217778105018573,"The 1st Lok Sabha was constituted on this day in 1952 after independent India's first general election.

The 1st Lok Sabha lasted its full tenure of five years and was dissolved on 4 April 1957. It had GV Mavlankar as Speaker, Jawaharlal Nehru as Leader of the House, and AK Gopalan as Leader of the Opposition. 

Image: Parliament House, New Delhi
Image source: Unknown",Timeline Photos,photo,https://www.facebook.com/logical.indian/photos/a.430765593719832.1073741828.426895610773497/1217778105018573/?type=3,2017-04-17 08:30:01,613,6,86,576,21,16,0,0,0
426895610773497_1217821685014215,"Mashal Khan was a young student who loved to question everything. For this, he was lynched by a mob of his fellow-students.","Mashal Khan, A Youth With A Promising Future, Killed By His Own Friends Over A Religious Debate",link,https://thelogicalindian.com/news/mashal-khan/,2017-04-17 08:00:00,7839,437,1256,3922,19,27,40,2080,1751
426895610773497_1217506058379111,"Every child is unique, every voice, worth listening to. But there are those who don't fit the boxes that the society tries to fit them into. They are those who make their own boxes,wherever they go.  The Logical Indian in association with Festember, NIT Trichy present Aashi, an initiative that celebrates autism in all it's forms. 

'Their faces lit up in joy as they painted with vegetables, conjured up stories, and played games that make childhood such a joy. These kids celebrated with an innocence touching to watch. Their differences were only gifts, in disguise.'

Presenting Aashi - organized by Festember, NIT Trichy to help make a difference to the lives of autistic children.

We hope this initiative will encourage more people to take part in the movement towards acceptance and appreciation.

""Autism is not contagious, Ignorance is""
#Autism #festember",Aashi,video,https://www.facebook.com/logical.indian/videos/1217506058379111/,2017-04-17 07:30:00,567,17,247,449,112,5,0,1,0
426895610773497_1217704605025923,The boy who freed thousands of working children before the age of 11 and then he was shot dead!,"22 Years Ago, He Was Murdered For Fighting Against Child Labour; Know About Him",link,https://thelogicalindian.com/story-feed/get-inspired/22-years-ago-he-was-murdered-for-fighting-against-child-labour-know-about-him/,2017-04-17 05:07:17,11658,91,2388,9417,500,59,5,1596,81
426895610773497_1217552868374430,"Education in India is very rigid and narrow, students who are rich with ideas and creative mindset are systematically made to fall in line with the system.",This Organisation Is Solving One Of The Greatest Problems Of Education System In India Through Arts.,link,https://thelogicalindian.com/my-social-responsibility/arts-21st-century-skills-artsparks/,2017-04-17 03:00:00,650,10,83,619,19,1,0,10,1
426895610773497_1216806415115742,"#Exclusive: The Logical Indian met the Indian Ice Hockey team who scripted their first international win last month despite all the difficulties the sport faces.

Read more:","A Month Later, Ice Hockey Has Hope And Pride In Ladakh",link,https://thelogicalindian.com/story-feed/exclusive/ice-hockey-hope-pride/,2017-04-16 11:00:00,1155,4,40,1119,26,10,0,0,0
426895610773497_1215805811882469,She was sold by her parents at the tender age of six to a brothel in Kolkata.,"Sold To A Brothel At The Age Of Six In Kolkata, This Girl Is Set To Study Law To Punish The Offenders",link,https://thelogicalindian.com/story-feed/exclusive/sex-trafficking/,2017-04-16 09:30:00,2860,17,218,2537,49,97,2,158,17
426895610773497_1216651898464527,"A former Indian Navy officer, Jadhav was arrested in March 2016 by Pakistan. On 10 April, he was sentenced to death for allegedly working for RAW. Read to know more.","All You Need To Know About Kulbhushan Jadhav, The Indian Sentenced To Death By Pakistan",link,https://thelogicalindian.com/news/kulbhushan-jadhav/,2017-04-16 08:00:00,3564,107,253,2706,12,7,21,460,358
426895610773497_1215808165215567,It is rare to see an actor calling out other actors for the racism that they encourage.,Actor Calls Out The Whitewashing & Subtle Racism Prevalent In Bollywood,link,https://thelogicalindian.com/story-feed/awareness/abhay-deol/,2017-04-16 03:30:00,592,12,33,559,17,1,12,0,3
426895610773497_1216395918490125,"The new constitution could throw Turkey into authoritarianism, enabling religious fundamentalists to replace progressive thinkers and sacrificing secularism for cronyism.","Today, the people of Turkey will vote on whether they want democracy or dictatorship",link,https://thelogicalindian.com/story-feed/awareness/turkey-referendum-2017/,2017-04-16 02:34:20,2454,112,144,2176,18,51,87,101,21
426895610773497_1215806225215761,The gap between the richest and the poorest states in India is among the highest in the world.,3 States' Contribution To India's GDP Higher Than That Of 20 States Combined,link,https://thelogicalindian.com/story-feed/awareness/gdp-india/,2017-04-16 00:30:00,2212,38,390,2074,15,79,18,21,5
426895610773497_1215792185217165,"Rs.44,000 crores are ideally sitting in the inoperative PF accounts. Claim your PF amount from your inoperative PF account","Rs 44,000 crore : Claim Your PF Amount From Your Inoperative PF Account.",link,https://thelogicalindian.com/good-to-know/government-awareness/amount-inoperative-pf-account/,2017-04-16 00:00:00,1112,62,412,1071,11,21,2,5,2
426895610773497_1216253141837736,Have you come across a pothole on the road? An overflowing dustbin? Or a choked drain? What did you do? Or can you really do anything?,What Will You Do If Your Area Is Filled With Garbage? This 19 Year Old Did Something Different To Clean A Beach,link,https://thelogicalindian.com/my-social-responsibility/beach-19-year-old-cleanup-2/,2017-04-15 23:30:00,3151,37,378,2990,85,70,1,3,2
426895610773497_1215762885220095,The 1997-batch IAS officer faced as much as three transfers within a period of one month during September 2016.,Haryana IAS Officer Transferred For 68th Time In 33 Years; Our Politicians Are Experts In Harassing Civil Servants,link,https://thelogicalindian.com/news/haryana-ias-officer/,2017-04-15 16:30:00,2312,41,411,1723,19,11,12,170,377
426895610773497_1215793978550319,"In the real world, when a girl is pinched or touched in a bus, it's called sexual harassment. Not love.
#GaanaRewrite with Akshara Centre","How Bollywood Songs Normalise Harassment, Stalking, And Sexism",link,https://thelogicalindian.com/my-social-responsibility/bollywood-songs/,2017-04-15 15:30:00,1402,52,235,1293,33,1,45,9,21
426895610773497_1215557328573984,Even after eleven years of the supreme court asking all states and the Centre to bring in reforms to make the police force more people-centric than ruler-centric not much has changed on the ground.,"11 Years After Famous SC Judgement On Police Reforms, Know What The Judgement Was & Where Do We Stand",link,https://thelogicalindian.com/story-feed/awareness/sc-judgement-police-reforms/,2017-04-15 07:49:26,1870,39,458,1443,3,2,13,142,267
426895610773497_1214201005376283,"via ~ Sports Possible
However times are changing and such initiatives by the government do speak about India's progressive attitude towards gender and its efforts for building an egalitarian society.",Kerala To Host The First State Level Transgender Sports Meet,link,https://thelogicalindian.com/story-feed/sports/transgender-sports/,2017-04-15 06:30:00,17977,119,2448,16610,905,440,17,2,3
426895610773497_1214299188699798,The 1997-batch IAS officer faced as much as three transfers within a period of one month during September 2016.,Haryana IAS Officer Transferred For 68th Time In 33 Years; Our Politicians Are Experts In Harassing Civil Servants,link,https://thelogicalindian.com/news/haryana-ias-officer/,2017-04-15 05:00:00,10282,178,2435,7392,28,77,67,825,1893
426895610773497_1214220922040958,His love for the city is so much that many luring career opportunities from distant places could not distract him from his noble motive.,This Chennai Activist Has Been Fighting For Over 40 Years To Make Indians Adopt Rainwater Harvesting,link,https://thelogicalindian.com/story-feed/exclusive/done_dr-sekhar-raghvan/,2017-04-15 03:15:00,3187,13,294,3017,116,49,0,5,0
426895610773497_1214306755365708,U.S. forces on Thursday night at 7:32 pm local time dropped the biggest non-nuclear weapons in its arsenal in a large-scale strike against ISIS in eastern Afghanistan.,US Drops Largest Non-Nuclear Bomb On Afghanistan,link,https://thelogicalindian.com/news/us-bomb-afghanistan/,2017-04-14 16:30:00,403,21,13,363,17,9,2,4,8
426895610773497_1214690395327344,The Logical Indian appeals all the media outlets to be more responsible and ethical towards its readers and restore the faith in journalism.,"Fact Check: Of Late, The News That Got Widely Shared But Were Not True",link,https://thelogicalindian.com/story-feed/awareness/fake-news-india/,2017-04-14 14:16:58,4861,187,1602,4348,99,24,318,27,45
426895610773497_1214323392030711,"Yesterday, UK officials told the UN and the world that the ongoing violence in South Sudan has escalated and a full-scale genocide has begun.

Formed in 2011, South Sudan is the world's youngest country.

While the country's citizens are mainly Christian, the country's ethnic divisions are extremely complicated. South Sudan has over 60 ethnic groups. The two largest groups are the Dinka and the Nuer.

South Sudan's first – and present – President is Salva Kiir. He is from the Dinka tribe. In an attempt to ensure the unity of the new country, Kiir appointed Riek Machar (of the Nuer tribe) as his Vice President.

Kiir assumed that appointing Machar as his Vice President would unify the two main tribes of the country – the Dinka and the Nuer – and bring stability.

However, Kiir's gamble did not pay off. The tense peace between the Dinka and the Nuer was soon broken.

In December 2013, the civil war broke out. Forces loyal to Kiir clashed with those loyal to Machar. The fighting rapidly spread throughout the country and evolved into a full-scale ethnic conflict.

In 2016, the United Nations warned that the stage was set for genocide in South Sudan. Tensions between the tribes are escalating. All sides are recruiting new soldiers and stockpiling more weapons.

The stage was long set for a genocide in South Sudan. Now, the genocide has begun.",Timeline Photos,photo,https://www.facebook.com/logical.indian/photos/a.430765593719832.1073741828.426895610773497/1214323392030711/?type=3,2017-04-14 11:00:00,511,42,72,305,1,2,1,162,40
426895610773497_1214319768697740,"""As per law, after 10 pm you cannot play loud music. If there is no permission, there is no question of banning it. Law says you can play loud music till 10 pm, after taking permission"", said the CM Manohar Parrikar.","Goa: No Partying Allowed, CM Manohar Parrikar Wants All Citizens To Sleep After 10 PM",link,https://thelogicalindian.com/news/goa-ban-party/,2017-04-14 10:30:00,9569,973,751,6213,146,84,2063,85,978
426895610773497_1214314298698287,"It was April 1917 when the Champaran Movement was born out of the gross injustice done to the farmers under the then British Raj.

100 years later, farmers are still dealing with the same level of injustice (if not more), only this time under our own government.

The Champaran movement seems very relevant now for it managed to connect urban issues with rural issues and brought Indians together on one platform. This is exactly what is needed today - for everyone to come together and stand up for our farmers.

(From the timeline of Suresh Ediga.)",Timeline Photos,photo,https://www.facebook.com/logical.indian/photos/a.430765593719832.1073741828.426895610773497/1214314298698287/?type=3,2017-04-14 10:00:00,11746,365,9141,9154,35,18,51,1777,711
426895610773497_1214353365361047,"On his birth anniversary, let us read the opinions of the Father of the Indian Constitution to understand Hinduism and Islam.",What BR Ambedkar Had To Say About Hinduism & Islam,link,https://thelogicalindian.com/story-feed/opinion/br-ambedkar-on-hinduism-and-islam/,2017-04-14 09:30:00,2416,73,338,2262,105,10,33,1,5
426895610773497_1214309575365426,The Logical Indian's exploration of ice hockey in India continues as we meet the players after their historic first international win in Thailand last month.,"A Month Later, Ice Hockey Has Hope And Pride In Ladakh",link,https://thelogicalindian.com/story-feed/exclusive/ice-hockey-hope-pride/,2017-04-14 09:00:00,2798,3,78,2669,109,18,2,0,0
426895610773497_1214328905363493,"Youth for Seva has engaged over 25,000 volunteers since its inception and has touched a million lives through its various projects.",Youth For Seva: The One Stop Destination For Volunteering,link,https://thelogicalindian.com/my-social-responsibility/one-stop-destination-for-volunteering/,2017-04-14 08:30:00,687,13,98,661,17,6,2,1,0
