status_id,status_message,link_name,status_type,status_link,status_published,num_reactions,num_comments,num_shares,num_likes,num_loves,num_wows,num_hahas,num_sads,num_angrys
1375307999395597_1869895649936827,The researchers now hope to find the enzyme used by the worms to degrade the plastic so that it can be produced on an industrial scale.,Answer to our woes? Scientists discover larvae that can naturally degrade plastic,link,http://www.thenewsminute.com/article/answer-our-woes-scientists-discover-larvae-can-naturally-degrade-plastic-60958,2017-04-29 09:00:00,0,0,0,0,0,0,0,0,0
1375307999395597_1872058546387204,"In the video, Emma Marrone can be seen pushing the man away but strangely, people seem to find it funny.",Italian TV show has male dancer grope female pop star as a 'prank': How low can we go?,link,http://www.thenewsminute.com/article/italian-tv-show-has-male-dancer-grope-female-pop-star-prank-how-low-can-we-go-61214,2017-04-29 08:30:00,10,0,0,9,0,0,0,0,1
1375307999395597_1872058203053905,"Stubble burning is illegal but, as the alternatives are either impractical or expensive, most farmers still do it.",How to fix India's burning issue: Turn unwanted straw into bio-energy pellets,link,http://www.thenewsminute.com/article/how-fix-indias-burning-issue-turn-unwanted-straw-bio-energy-pellets-61208,2017-04-29 08:10:46,5,0,0,5,0,0,0,0,0
1375307999395597_1872045576388501,Chennai: Hong Kong's Liu Tsz Ling plays a shot against India's Dipika Pallikal during women's quarter-final match at 19th Asian Squash Championship in Chennai on Friday. (PTI Photo),Timeline Photos,photo,https://www.facebook.com/TheNewsMinute/photos/a.1404987593094304.1073741828.1375307999395597/1872045576388501/?type=3,2017-04-29 07:27:14,7,1,0,7,0,0,0,0,0
1375307999395597_1872031706389888,"Senkumar in his plea, has termed the delay in issuing orders on Netto's part as 'willful and deliberate disobedience' of the SC.",TP Senkumar moves SC to initiate contempt proceedings against Kerala chief secy Nalini Netto,link,http://www.thenewsminute.com/article/tp-senkumar-moves-sc-initiate-contempt-proceedings-against-kerala-chief-secy-nalini-netto,2017-04-29 06:47:35,16,0,2,16,0,0,0,0,0
1375307999395597_1870938596499199,"IPL has fast-tracked young Indian cricketers into international reckoning, where once the road was arduous.","If IPL was born earlier, these lesser-known Indian cricketers who would have rocked it",link,http://www.thenewsminute.com/article/if-ipl-was-born-earlier-these-lesser-known-indian-cricketers-who-would-have-rocked-it-61081,2017-04-29 04:30:00,385,0,1,384,1,0,0,0,0
1375307999395597_1871989459727446,"The Telugu version of the film netted a whopping Rs. 53 crore on the first day, according to trade analysts.",'Baahubali 2' collects a staggering Rs. 100 crore on first day,link,http://www.thenewsminute.com/article/baahubali-2-breaks-record-collections-cross-rs-100-crore-first-day-61203,2017-04-29 04:12:04,456,4,12,432,10,12,2,0,0
1375307999395597_1871958093063916,Guwahati: Baya Weaver (Ploceus Philppinus) birds busy in making their nests in Chandrapur on the outskirts of Guwahati. (PTI Photo),TheNewsMinute's cover photo,photo,https://www.facebook.com/TheNewsMinute/photos/a.1395151570744573.1073741827.1375307999395597/1871958056397253/?type=3,2017-04-29 02:38:56,44,0,4,39,4,1,0,0,0
1375307999395597_1869389233320802,"For the Rohingyas, who often face hostility from Indian neighbours, football seems one way to turn the tension into camaraderie.",A field of their own: How football is helping Rohingya refugees find their place in India,link,http://www.thenewsminute.com/article/field-their-own-how-football-helping-rohingya-refugees-find-their-place-india-60881,2017-04-29 02:30:00,4,2,0,4,0,0,0,0,0
1375307999395597_1871922493067476,"The suitcases were found at three different places in the airport, including the car park area.","Unclaimed suitcases trigger scare at Chennai airport, vigil stepped up",link,http://www.thenewsminute.com/article/unclaimed-suitcases-trigger-scare-chennai-airport-vigil-stepped-61193,2017-04-29 01:35:00,6,0,0,6,0,0,0,0,0
1375307999395597_1871920879734304,"#Breaking: Another twist to the Kodanadu murder case. Prime suspect killed in road accident in TN, while his associate suffers  injuries in accident in Kerala.",Kodanadu murder suspect injured in accident in Palakkad after Jaya's ex-driver's death,link,http://www.thenewsminute.com/article/murder-or-accident-jayalalithaas-ex-driver-linked-kodanadu-crime-found-dead-61190,2017-04-29 01:20:11,54,0,3,48,0,1,2,2,1
1375307999395597_1869407293318996,"Nivin Pauly explains to the kids what a ""good"" and ""bad"" touch is, and what they should do if they come across a potential molester.","'No, Go, Tell': Watch actor Nivin Pauly talk to children about child body safety",link,http://www.thenewsminute.com/article/no-go-tell-watch-actor-nivin-pauly-talk-children-about-child-body-safety-60889,2017-04-29 01:10:00,314,2,63,278,33,2,1,0,0
1375307999395597_1871578673101858,"You can use your faith to terrify people into submission, or you can use it to give them courage ""so they rise to the greatest heights of enlightenment,"" he said.","I sell dreams, peddle love: Shah Rukh Khan becomes the first Indian actor at TED in Canada",link,http://www.thenewsminute.com/article/i-sell-dreams-peddle-love-shah-rukh-khan-becomes-first-indian-actor-ted-canada-61166,2017-04-29 01:00:00,14,1,1,14,0,0,0,0,0
1375307999395597_1871905103069215,#Breaking: Kanagaraj is the prime suspect in the murder of the security guard at #Kodanadu estate. #Jayalalithaa,Murder or accident? Jayalalithaa's ex-driver linked with Kodanadu crime found dead,link,http://www.thenewsminute.com/article/murder-or-accident-jayalalithaas-ex-driver-linked-kodanadu-crime-found-dead-61190,2017-04-29 00:35:00,161,4,26,147,0,0,8,0,6
1375307999395597_1871555989770793,The External Affairs Minister believes that it's necessary for men to learn kitchen skills to ease the burden on women.,"'Men should learn home science, women, martial arts': Is Yogi listening to Sushma Swaraj?",link,http://www.thenewsminute.com/article/men-should-learn-home-science-women-martial-arts-yogi-listening-sushma-swaraj-61162,2017-04-29 00:30:00,97,0,12,87,5,1,4,0,0
1375307999395597_1871898019736590,There are reasons why the BJP has got into election gear a good two years before elections are due in Telangana.,"BJP's next mission in the south is Opposition Telangana, but can they out-Hindu KCR?",link,http://www.thenewsminute.com/article/bjp-s-next-mission-south-opposition-telangana-can-they-out-hindu-kcr-61186,2017-04-29 00:13:07,37,13,5,27,0,0,10,0,0
1375307999395597_1871531479773244,The atmosphere was thick with anticipation as 132 trans persons turned up from various districts of the state to participate.,"With lots of cheer and jubilation, Kerala has its first sports meet for transgender persons",link,http://www.thenewsminute.com/article/lots-cheer-and-jubilation-kerala-has-its-first-sports-meet-transgender-persons-61154,2017-04-29 00:00:00,38,1,6,34,3,1,0,0,0
1375307999395597_1871555396437519,The External Affairs Minister believes that it's necessary for men to learn kitchen skills to ease the burden on women.,"'Men should learn home science, women, martial arts': Is Yogi listening to Sushma Swaraj?",link,http://www.thenewsminute.com/article/men-should-learn-home-science-women-martial-arts-yogi-listening-sushma-swaraj-61162,2017-04-28 23:45:00,209,13,37,187,18,2,2,0,2
1375307999395597_1871599943099731,We bring you stories of seven women who were sexually harassed at work and how they dealt with it.,TheNewsMinute,photo,https://www.facebook.com/TheNewsMinute/photos/a.1871403226452736.1073741904.1375307999395597/1871403236452735/?type=3,2017-04-28 23:30:00,4,0,0,4,0,0,0,0,0
1375307999395597_1871880596404999,"If this is shocking enough, the cost of the project is also very high and is pegged at Rs 12.5 crore per drilling.","K'taka minister wants 1-km deep borewell dug for water, clueless that it could worsen the problem",link,http://www.thenewsminute.com/article/k-taka-minister-wants-1-km-deep-borewell-dug-water-clueless-it-could-worsen-problem-61185,2017-04-28 23:20:56,59,10,15,30,0,3,14,4,8
1375307999395597_1871877253072000,A five member gang from Thrissur is said to be involved in the suspected burglary and murder.,Kodanad shocker: Was Jayalalithaa's former driver involved in the murder of estate guard?,link,http://www.thenewsminute.com/article/kodanad-shocker-was-jayalalithaas-former-driver-involved-murder-estate-guard-61179,2017-04-28 23:09:54,173,2,16,161,1,0,8,2,1
1375307999395597_1871862216406837,"The police also arrested a theatre owner, after an employee was found with more than 100 tickets.","Black tickets for 'Baahubali 2' rampant in Hyderabad, as police arrest 21 in a single day",link,http://www.thenewsminute.com/article/black-tickets-baahubali-2-rampant-hyderabad-police-arrest-21-single-day-61178,2017-04-28 22:45:00,15,0,2,15,0,0,0,0,0
1375307999395597_1871841703075555,The family also demanded that a statue of the Nizam be installed at a suitable place in the premises of Osmania University.,Family of Hyderabad's last Nizam unhappy over being 'ignored' at Osmania Uni centenary event,link,http://www.thenewsminute.com/article/family-hyderabads-last-nizam-unhappy-over-being-ignored-osmania-uni-centenary-event-61176,2017-04-28 21:45:00,26,0,3,25,0,0,0,1,0
1375307999395597_1871834423076283,TTV Dhinakaran had allegedly offered Rs 50 crore in bribes to the EC officials to get the two-leaves symbol.,"TTV Dhinakaran ECI bribery case: Delhi hawala operator held, 50 others questioned",link,http://www.thenewsminute.com/article/ttv-dhinakaran-eci-bribery-case-delhi-hawala-operator-held-50-others-questioned-61174,2017-04-28 21:12:52,20,0,1,19,0,0,0,1,0
1375307999395597_1871533816439677,"While farmers have been demanding Rs 10,000 per quintal for their crops to break even, market prices have fallen to just Rs 3,000.",Desperate Telangana chilli farmers go on rampage and destroy Khammam market yard,link,http://www.thenewsminute.com/article/desperate-telangana-chilli-farmers-go-rampage-and-destroy-khammam-market-yard-61159,2017-04-28 20:30:00,6,0,0,6,0,0,0,0,0
1375307999395597_1871608186432240,"#Replug Unlike ordinary khadi, the khadi denim fabric does not need starching, ironing or whitening, Siddharth says.","Giving up jeans for the mundu, this Kerala student now runs a khadi denim business",link,http://www.thenewsminute.com/article/giving-jeans-mundu-kerala-student-now-runs-khadi-denim-business-50737,2017-04-28 12:00:00,103,1,5,96,3,4,0,0,0
1375307999395597_1871600729766319,The absurd interest in Emmanuel Macron's personal life would have one believe that he indulges in Roman style orgies every day.,"French presidential candidate Macron is 39, his wife 64: Why do we find this so hard to accept?",link,http://www.thenewsminute.com/article/french-presidential-candidate-macron-39-his-wife-64-why-do-we-find-so-hard-accept-61093,2017-04-28 11:20:00,38,0,8,38,0,0,0,0,0
1375307999395597_1871533579773034,"While farmers have been demanding Rs 10,000 per quintal for their crops to break even, market prices have fallen to just Rs 3,000.",Desperate Telangana chilli farmers go on rampage and destroy Khammam market yard,link,http://www.thenewsminute.com/article/desperate-telangana-chilli-farmers-go-rampage-and-destroy-khammam-market-yard-61159,2017-04-28 11:00:00,11,1,0,10,0,1,0,0,0
1375307999395597_1871484933111232,"His chemistry with Rajinjkanth in Guru Sishyan is unforgettable. But later, he was typecast in rustic roles. A #mustread article on Vinu Chakravarthy.",The man who found Silk Smitha: Vinu Chakravarthy reminded us of the classicism in cinema,link,http://www.thenewsminute.com/article/man-who-found-silk-smitha-vinu-chakravarthy-reminded-us-classism-cinema-61116,2017-04-28 10:45:00,73,0,1,69,0,0,0,4,0
1375307999395597_1871643426428716,"He was in a foul mood, pissed off at a colleague who was clearly incompetent despite being from an IIT. ""He must be a quota guy,"" she quipped.' #Replug",How does India's caste system work in the 21st century? Quora user hits the bull's eye,link,http://www.thenewsminute.com/article/how-does-india's-caste-system-work-21st-century-quora-user-hits-bull's-eye-35962,2017-04-28 10:42:11,410,25,90,347,0,0,44,6,13
1375307999395597_1871602669766125,"Karnataka is the country's largest producer of millets, yet the humble millet is steadily losing out to foreign superfood options like chia seeds and quinoa.","Move over other superfoods, Karnataka farmers can now sell their millets online",link,http://www.thenewsminute.com/article/move-over-other-superfoods-karnataka-farmers-can-now-sell-their-millets-online-61173,2017-04-28 10:00:00,48,1,3,45,3,0,0,0,0
1375307999395597_1871473629779029,"Rajamouli not only gives us a worthy second film, he knocks it out of the park.","'Baahubali 2' Review: A fantastic, must-watch sequel with strong characters and an intriguing plot",link,http://www.thenewsminute.com/article/baahubali-2-review-fantastic-must-watch-sequel-strong-characters-and-intriguing-plot-61136,2017-04-28 09:40:00,264,0,10,255,9,0,0,0,0
1375307999395597_1871472033112522,"Sex workers can be sexually harassed and raped too, and it's high time we recognised that

Sneha*, a sex worker from Chennai, is routinely objectified. But more than any other profession, sex workers routinely face violence at the workplace - and have little recourse under the law.

""I am a Sex Worker from Chennai, and while I did not 'choose' my profession, I have never been ashamed of the work I do. 

But most of the time, I am treated as an object. Almost all of the time, my rights over my body are denied. 

One day, a policeman forced oral sex on me. He had the power of the 'uniform'. He started penetrating my mouth, and too see far I could take it, he inserted his lathi into my mouth to widen it. 

He broke my molar tooth while doing so. I felt humiliated, and I howled in pain. But he neither asked nor cared for my consent. 

In another instance, an acquaintance took me to a client for a professional commitment. But suddenly, the client brought five more men with him. I was shocked, and refused to go with them, but they started molesting and sexually assaulting me. 

They took advantage of my profession, and did not stop to consider me a human being. I was helpless and numb with pain for the next five hours. They left me somewhere at night, and did not even pay me. I struggled to get back home.

But in my line of work, there is little I can do for justice. These are just two such incidents I have faced in my 20-year career. I have also been sexually harassed on the streets too. Once, I took a complaint to the police, and after that experience I have never tried to go back to them for help. Instead of taking my complaint and helping me, they blamed me instead for what happened to me.""

(*Name changed; As told to Sudaroli Ramasamy)

This post is part of a series in collaboration with Prajnya, on World Day for Safety and Health at Work.",Timeline Photos,photo,https://www.facebook.com/TheNewsMinute/photos/a.1404987593094304.1073741828.1375307999395597/1871472033112522/?type=3,2017-04-28 09:30:00,38,3,4,16,0,0,0,17,5
1375307999395597_1871590993100626,The principal of the school also reportedly told the victim's friends not to sit next to her.,Delhi school allegedly asks rape survivor to leave for the sake of its 'reputation',link,http://www.thenewsminute.com/article/delhi-school-allegedly-asks-rape-survivor-leave-sake-its-reputation-61170,2017-04-28 09:20:00,102,8,16,41,0,0,1,7,53
1375307999395597_1871594019766990,"The SC had commuted Govindachamy's death sentence to a life term, saying the prosecution had failed to prove its case.","Major setback for Kerala government, SC rejects curative petition on Soumya murder case",link,http://www.thenewsminute.com/article/major-setback-kerala-government-sc-rejects-curative-petition-soumya-murder-case-61171,2017-04-28 09:10:00,12,1,1,11,0,0,0,1,0
1375307999395597_1871529636440095,The atmosphere was thick with anticipation as 132 trans persons turned up from various districts of the state to participate.,"With lots of cheer and jubilation, Kerala has its first sports meet for transgender persons",link,http://www.thenewsminute.com/article/lots-cheer-and-jubilation-kerala-has-its-first-sports-meet-transgender-persons-61154,2017-04-28 09:00:00,239,1,24,216,14,8,1,0,0
1375307999395597_1871577533101972,"'Whatever moves you, urges you to create... whatever keeps you from failing, helps you survive, is perhaps the oldest and the simplest emotion known to mankind, and that is love.'","I sell dreams, peddle love: Shah Rukh Khan becomes the first Indian actor at TED in Canada",link,http://www.thenewsminute.com/article/i-sell-dreams-peddle-love-shah-rukh-khan-becomes-first-indian-actor-ted-canada-61166,2017-04-28 08:45:00,17,0,0,16,1,0,0,0,0
1375307999395597_1871471606445898,"""A week after I met him for work, he insisted I watch a movie with him and refused to listen to me""

Savita* is a social worker operating in the health sector in Tiruvallur district of Tamil Nadu. Savita encountered a medical practitioner, who did not take no for an answer to his advances. This is her story...

""In my line of work, I meet various stakeholders in the health sector and this includes doctors. I had a couple of interactions with a medical practitioner. A week after the last meeting I had with him, he called me at 12.30pm.

He asked me if I wanted to watch a movie with him. ""Nobody is home and I thought of taking you to a movie,"" he said. He did not wait for my response, and asked me when he should pick me up. I was shocked at his behaviour and told him quite sternly to never indulge in such talk with me, and disconnected the call.

He did not take no for an answer though. Just two days after this incident, he started sending me messages on WhatsApp. He would say that I looked ""hot"" in my profile picture and would sometimes send me sex-related texts too.

I grew angry by the day and I finally sent him a strongly-worded message telling him to stop sending me any messages at all. Despite this he did not stop and I finally blocked him.

In another instance, I had a meeting with a radiologist who seemed interested in the work that I do. While I was explaining the details of a project to him, he never made eye contact. He rather chose to look at my neck and chest. I felt extremely uncomfortable and got up from my seat with the intention to leave.

He immediately got up and pressed my shoulder down, telling me to ""please be seated"". I was not at all comfortable by his advance and I walked out of the room.

Soon after this incident, I shared my experiences with a colleague who is also a doctor. He suggested that if the harassment continues, I must report it to the management. 

But there are so many questions that linger in my mind. What can the management do if the harassment happens outside its purview? If such instances occur in the future in a public area, are there complaint mechanisms. Even if there is one will the people associated with these helplines address the issue with fairness?""

(*Name changed; As told to Sudaroli Ramasamy)

This post is part of a series in collaboration with Prajnya, on World Day for Safety and Health at Work.",Timeline Photos,photo,https://www.facebook.com/TheNewsMinute/photos/a.1404987593094304.1073741828.1375307999395597/1871471606445898/?type=3,2017-04-28 08:30:00,12,0,2,12,0,0,0,0,0
1375307999395597_1871470543112671,"""I was asked for sexual favours for a job, I filed a police complaint instead""

Glynis Luan Simoes, a cabin crew member, was recently contacted by a former employee of an airline company in India. She was offered a job with a corporate for their charter airlines - but in return, they demanded some 'favours'...

""This happened recently in March-April, 2017. A person called Renuka, who claimed to be a former crew member of an Indian airline contacted me to discuss a possibility of working with an Indian corporate, on their charter airlines. Subsequently, a person called Avinash who said he was from the HR department of the company contacted me regarding the position. 

Following an interview, both, Renuka and Avinash suggested that in order to secure this job, I was to provide some ""personal benefits"" to some members of the HR department. They suggested that sexual compromises were commonplace in this industry, and securing such a job would mean providing such favours.

Completely disgusted with this exchange, I told them that they should not contact me further, regarding this or anything else. 

Following this I filed a complaint and an FIR with the local police station informing them of this incident. They filed my complaint under section 509 (words, gesture or act intended to insult the modesty of a woman) and section 34 (acts done by several persons in furtherance of common intention), and have begun their investigation.

I was able to discuss this incident with my colleagues, co-workers and family. They were supportive with my stance to take legal action against these people and I would encourage other women in such a position to do the same. 

No woman should have to rely on anything other than her skills, knowledge and training to secure and keep any job.""

(As told to Radhika Bhalerao)

This post is part of a series in collaboration with Prajnya, on World Day for Safety and Health at Work.",Timeline Photos,photo,https://www.facebook.com/TheNewsMinute/photos/a.1404987593094304.1073741828.1375307999395597/1871470543112671/?type=3,2017-04-28 07:30:00,28,2,5,22,2,0,0,3,1
1375307999395597_1871533229773069,The male student was allegedly upset at the girls for teasing him relentlessly and decided to take revenge.,"Taunted as teacher's pet, Mysuru student uploaded junior's photos on escort services site",link,http://www.thenewsminute.com/article/taunted-teachers-pet-mysuru-student-uploaded-juniors-photos-escort-services-site-61158,2017-04-28 06:43:35,109,2,3,99,1,1,4,0,4
1375307999395597_1871532633106462,The Judge directed the authorities to circulate the rules in Tamil to all the owners of the elephants.,"Use of elephants in temples for taking money exploitative, amounts to begging: Madras HC",link,http://www.thenewsminute.com/article/use-elephants-temples-taking-money-exploitative-amounts-begging-madras-hc-61160,2017-04-28 06:40:56,30,3,3,27,3,0,0,0,0
1375307999395597_1871470086446050,"""When I didn't return his advances, he told my seniors I wanted to quit""

Noor* is a 30-year-old social worker whose colleague tried to make her workplace hostile when she wouldn't return his advances. But Noor's colleagues realised what was happening...

""I used to work as an area coordinator with an NGO working towards waste management in Pune in 2014. We were a four-member team; there was another person, Ankur*, who was in the same position as me, although he had more experience. We hit it off instantly. Long conversations, friendly banter, it was all good.

There were times where I felt he was dropping me hints that he was interested in me. He would continuously stare at me during meetings, for example. I can't pinpoint to particular instances because it was never overt. It was always the way he conducted himself physically, little gestures, eye contact and so on. 

It made me uncomfortable, but since he was married, and I was quite open about my own relationship, I didn't make a big deal of it. But then one day he realised that I wasn't going to respond to his advances or encourage him, and that's when things changed. 

Ankur stopped talking to me and treated me coldly. He wouldn't give weight to my ideas and suggestions in meetings. I tried to raise complaints about how he was arbitrarily taking decisions, but nothing deterred him.

He even told our senior management that I wanted to leave because work was too far away for me. When the lady in charge called me and told me they could ask someone else to take my position, I was shocked. I told her quite vehemently that that I did not want to quit. 

But they gave me an area transfer anyway. I was quite upset initially but it worked out for the best. I believe that the women who were at senior positions understood what was happening and sought to remove Ankur from my work path. It could have been a very different story if there had been men at the senior positions. 

The whole ordeal lasted 3-4 months and it was quite traumatic because I didn't know what was happening. He didn't do anything explicit to sexually harass me, it was all body language and mind games. I've realised that just because you are liberal, doesn't mean everyone is. And that male egos are very fragile.""

(*Name changed; As told to Geetika Mantri)

This post is part of a series in collaboration with Prajnya, on World Day for Safety and Health at Work.",Timeline Photos,photo,https://www.facebook.com/TheNewsMinute/photos/a.1404987593094304.1073741828.1375307999395597/1871470086446050/?type=3,2017-04-28 06:30:00,10,0,2,9,0,0,0,0,1
1375307999395597_1871529289773463,The Eshwarappa faction has demanded that their leader be made the state party President instead of Yeddyurappa.,"In the Eshwarappa-Yeddyurappa battle, Puttaswamy gets kicked out of meeting once again",link,http://www.thenewsminute.com/article/eshwarappa-yeddyurappa-battle-puttaswamy-gets-kicked-out-meeting-once-again-61156,2017-04-28 06:26:11,7,1,0,2,0,0,5,0,0
1375307999395597_1871510633108662,India featured in the top-3 for the third successive year as per a WADA report published for 2015.,"117 Indian athletes test positive for banned substances, govt mulls jail term for offenders",link,http://www.thenewsminute.com/article/117-indian-athletes-test-positive-banned-substances-govt-mulls-jail-term-offenders-61153,2017-04-28 05:36:11,11,0,2,11,0,0,0,0,0
