status_id,status_message,link_name,status_type,status_link,status_published,num_reactions,num_comments,num_shares,num_likes,num_loves,num_wows,num_hahas,num_sads,num_angrys
1375307999395597_1871466619779730,"How I won a case of sexual harassment against professors at my film institute

Kunjila Mascillamani is a 25-year-old filmmaker, was assigned to work on a project with a student who had sexually harassed her in the past. Upset with the decision, Kunjila approached the institute's director. When she pursued her case, it opened a can of worms - and complaints poured in about some professors too...

""When I was student of direction at Satyajit Ray Film & Television Institute in Kolkata, I was working on a film in December 2015 and the student assigned to be on the edit team had a history of sexually harassing me. I didn't want to work with him but when I approached my dean, he laughed at me. So, I went to the director of the institute, asking him that I needed a forum to talk about the issue.

It was then that I found out that each government institute at least, is supposed to have an Internal Complaints Committee (ICC) to deal with cases of sexual harassment at the workplace. The chairperson of the ICC then called a meeting with all the girls, and to our shock, many girls spoke about being sexually harassed by professors as well as fellow students.

The next day, 7-8 of us filed written complaints with the ICC. I had named two professors and two students in my complaint. One of these professors had also raped me, but I told the ICC that I did not want to pursue the case legally. In total, three professors were named, all complaints put together.

What followed for the next eight months was absolute hell. We were isolated and slut-shamed. No one spoke to us. Some of the professors even instigated other students, who then threatened and assaulted us a couple of times, thinking that we were lying. Some of us weren't able to find projects to work on because we were bad mouthed to our prospective employers.

I was already on medication but the whole situation had taken an even more severe toll on my mental and emotional health. 

We eventually won the case in the ICC and two of the professors were sent into early retirement. They have now filed a motion in the Kolkata High Court challenging the ICC's decision.

But SRFTI forwarded the rape case I had filed against the third professor to the police, without my consent. The case is now ongoing in the Kolkata High Court, but I haven't been called for any hearings so far.

I graduated two months ago and now work in Mumbai. I have moved on with my life but the whole ordeal was traumatising. I still suffer from the psychological effects, but I am glad that it wasn't all for nothing. At least our juniors and the younger students won't have to go through what we did.""

(As told to Geetika Mantri)

This post is part of a series in collaboration with Prajnya, on World Day for Safety and Health at Work.",Timeline Photos,photo,https://www.facebook.com/TheNewsMinute/photos/a.1404987593094304.1073741828.1375307999395597/1871466619779730/?type=3,2017-04-28 05:00:00,4,0,3,4,0,0,0,0,0
1375307999395597_1871495746443484,Chennai: India's Joshna Chinappa and Jemyca Aribado (Philippines) in action during their match at the 19th Asian Squash Championships in Chennai on Thursday. (PTI Photo),Timeline Photos,photo,https://www.facebook.com/TheNewsMinute/photos/a.1404987593094304.1073741828.1375307999395597/1871495746443484/?type=3,2017-04-28 04:49:36,8,0,0,8,0,0,0,0,0
1375307999395597_1871495136443545,Chennai: India's Joshna Chinappa and Jemyca Aribado (Philippines) in action during their match at the 19th Asian Squash Championships in Chennai on Thursday. (PTI Photo),Timeline Photos,photo,https://www.facebook.com/TheNewsMinute/photos/a.1404987593094304.1073741828.1375307999395597/1871495136443545/?type=3,2017-04-28 04:48:28,6,0,0,6,0,0,0,0,0
1375307999395597_1871486483111077,The CBI had sought to cancel his bail on the grounds that he could influence witnesses.,"Relief for Jagan Reddy, as Hyderabad court dismisses CBI petition to cancel bail",link,http://www.thenewsminute.com/article/relief-jagan-reddy-hyderabad-court-dismisses-cbi-petition-cancel-bail-61151,2017-04-28 04:45:00,9,0,0,9,0,0,0,0,0
1375307999395597_1871485219777870,"Kamaraj had allegedly demanded Rs 30 lakh to evict a person from the realtor's property, but had cheated him once the money was paid.","File FIR against Food Minister Kamaraj for allegedly cheating a realtor, SC tells TN govt",link,http://www.thenewsminute.com/article/file-fir-against-food-minister-kamaraj-allegedly-cheating-realtor-sc-tells-tn-govt-61150,2017-04-28 04:30:00,29,0,3,25,0,0,4,0,0
1375307999395597_1871485966444462,"Where does the energy, the drive or perhaps the motivation come from? Prateek Sharma tries to find out.",Inside the mind of a troll: The psychology behind the vicious trolling women face online,link,http://www.thenewsminute.com/article/inside-mind-troll-psychology-behind-vicious-trolling-women-face-online-61147,2017-04-28 04:16:10,16,0,6,16,0,0,0,0,0
1375307999395597_1871465649779827,"Domestic workers are often harassed at their workplace, but their voices are rarely heard

Sushma*, a domestic worker, was employed in the house of Jonathan*. Sushma says her daughter, who also worked in the same house as a babysitter, was sexually harassed by Jonathan. And when she questioned her employer, he resorted to assaulting her too. This is her story:

""I worked as a domestic help at a house in Bellandur in October 2016. My 19-year-old daughter, Divya*, would accompany me to babysit the children of the couple who lived there.

One day, Jonathan*, the man of the house, tried to compel my daughter to buy a swimsuit even though she said she was uncomfortable with it. He showed her pictures of women in swimsuits on his laptop, when she didn't want to look at them. He even showed her porn clips. When I confronted him, he denied showing her anything 'wrong.'

Another time, he told me to do somersaults when I didn't know how. He kept harassing my daughter, making her uncomfortable. I strictly told him to leave her alone many times, but he did not listen. Tired of his harassment, we approached the society's residents' welfare committee. The committee members were scared that Jonathan would harm their kids, and told me to file a police complaint.

Divya and I quit without taking the Rs 37,000 salary he owed us at that point. We tried going to the police, but they just mocked us and did not file an FIR. In the meantime, Jonathan's harassment continued. He went to the employers at the other houses we worked at, and told them that we had stolen from him. We lost many jobs this way. But there were others who trusted us and didn't believe him.

We contacted an NGO too, and went to the police again. But once again, the FIR wasn't filed. 

Then, in mid-March, I was walking to work when Jonathan pulled up next to me in a car and pushed me to the ground. I was very disoriented, and before I knew it, he had hit the back of my head with a rock and sped away.

The only good thing that came out of this perhaps was that the police could see the wound and had to file a complaint. The FIR was registered on charges of sexual harassment at the workplace, and assault.

Jonathan is still at large though. And while Divya and I have moved on with our lives now and we still live in fear, he continues to harass my employers now and then. But who will help us?""

(*Names changed; As told to Theja Ram)

This post is part of a series in collaboration with Prajnya, on World Day for Safety and Health at Work.",Timeline Photos,photo,https://www.facebook.com/TheNewsMinute/photos/a.1404987593094304.1073741828.1375307999395597/1871465649779827/?type=3,2017-04-28 03:30:00,27,0,3,8,0,0,0,6,13
1375307999395597_1871467966446262,Delhi Crime Branch also arrested a hawala operator in the national capital for facilitating money laundering.,Dhinakaran bribery case: Delhi police carry out raids on construction company in Chennai,link,http://www.thenewsminute.com/article/dhinakaran-bribery-case-delhi-police-carry-out-raids-construction-company-chennai-61146,2017-04-28 03:18:33,51,0,9,47,1,0,3,0,0
1375307999395597_1871455576447501,"Santhosh has long distrusted Yeddyurappa for putting his caste loyalties ahead of the party's best interest, say party sources.",The RSS man that Yeddyurappa blames for Eshwarappa's rebellion: Who is he and what is his role?,link,http://www.thenewsminute.com/article/rss-man-yeddyurappa-blames-eashwarappas-rebellion-who-he-and-what-his-role-61142,2017-04-28 03:00:00,129,8,15,110,4,0,13,0,2
1375307999395597_1871442109782181,The HC wants to know what measures the State Police Chief has taken on the matter.,"Now, Kerala HC slams Minister MM Mani for his derogatory comment on women's group",link,http://www.thenewsminute.com/article/now-kerala-hc-slams-minister-mm-mani-his-derogatory-comment-womens-group-61138,2017-04-28 02:40:00,9,0,1,9,0,0,0,0,0
1375307999395597_1871414866451572,"Myth: Sexual harassment doesn't happen in 'high class' workplaces. Truth: Read Anjali's story. 
Prajnya",TheNewsMinute,photo,https://www.facebook.com/TheNewsMinute/photos/a.1871403226452736.1073741904.1375307999395597/1871403446452714/?type=3,2017-04-28 02:30:00,4,0,0,4,0,0,0,0,0
1375307999395597_1871439446449114,"The film has fans raving and gushing online. And don't worry, no spoilers here! #Baahubali2","If you haven't watched Baahubali 2, keep away from social media because there are SPOILERS!",link,http://www.thenewsminute.com/article/if-you-haven-t-watched-baahubali-2-keep-away-social-media-because-there-are-spoilers-61137,2017-04-28 02:13:58,62,0,3,56,1,0,5,0,0
1375307999395597_1871428953116830,"#Baahubali2 #BaahubaliTheConclusion Rajamouli not only gives us a worthy second film, he knocks it out of the park.","'Baahubali 2' Review: A fantastic, must-watch sequel with strong characters and an intriguing plot",link,http://www.thenewsminute.com/article/baahubali-2-review-fantastic-must-watch-sequel-strong-characters-and-intriguing-plot-61136,2017-04-28 01:52:12,3461,34,144,3247,150,52,10,0,2
1375307999395597_1871413019785090,18th Parallel lets you convert your TV into a gaming console using your Android set-top box.,This startup is bringing fun smartphone games to your big TV screen,link,http://www.thenewsminute.com/article/startup-bringing-fun-smartphone-games-your-big-tv-screen-61135,2017-04-28 01:40:00,3,1,0,3,0,0,0,0,0
1375307999395597_1871008426492216,An international team of genetic researchers are trying to find the answer to this bizarre phenomenon.,Kodinhi: A Kerala village with 400 pairs of twins that continues to be a mystery to researchers,link,http://www.thenewsminute.com/article/kodinhi-kerala-village-400-pairs-twins-continues-be-mystery-researchers-61083,2017-04-28 01:30:00,51,0,39,48,1,0,2,0,0
1375307999395597_1871403236452735,"Sexual harassment is a reality for most women - in public spaces and private ones. Recently, a number of cases of workplace sexual harassment have come to light - but neither are they the first such occurrences nor the last. 

In fact, women in India face sexual harassment at the workplace at all levels.

April 28 is the World Day for Safety and Health at Work, and this year, TheNewsMinute has tied up with Prajnya, an NGO in Chennai that works on gender violence and women's rights, to bring you seven stories of women who have faced harassment while at work, and have dealt with it in their own ways. 

Follow the album to read on, and if you would like to share your stories, write to us: email@thenewsminute.com",How women deal with sexual harassment at the workplace,photo,https://www.facebook.com/TheNewsMinute/photos/a.1871403226452736.1073741904.1375307999395597/1871403236452735/?type=3,2017-04-28 01:17:08,26,1,26,19,1,0,0,3,3
1375307999395597_1871408479785544,The criminal case was filed against the celebrity couple for allegedly failing to pay for products sold through the channel.,"Shilpa Shetty, husband Raj Kundra booked for allegedly cheating businessman of Rs 24 lakh",link,http://www.thenewsminute.com/article/shilpa-shetty-husband-raj-kundra-booked-allegedly-cheating-businessman-rs-24-lakh-61134,2017-04-28 01:08:34,20,0,1,20,0,0,0,0,0
1375307999395597_1871408123118913,Faizabad: A monkey quenches its thirst on a hot day at Faizabad railway station in Uttar Pradesh. (PTI Photo),TheNewsMinute's cover photo,photo,https://www.facebook.com/TheNewsMinute/photos/a.1395151570744573.1073741827.1375307999395597/1871408093118916/?type=3,2017-04-28 01:06:08,45,1,3,44,0,0,0,1,0
1375307999395597_1871013209825071,"#Replug ""I really don't think there is any job that men alone can do,"" says Latha.",Meeting Latha: A woman mechanic fighting stereotypes in Theni,link,http://www.thenewsminute.com/article/meeting-latha-woman-mechanic-fighting-stereotypes-theni-40063,2017-04-28 00:45:00,315,3,36,295,14,6,0,0,0
1375307999395597_1870973583162367,The absurd interest in Emmanuel Macron's personal life would have one believe that he indulges in Roman style orgies every day.,"French presidential candidate Macron is 39, his wife 64: Why do we find this so hard to accept?",link,http://www.thenewsminute.com/article/french-presidential-candidate-macron-39-his-wife-64-why-do-we-find-so-hard-accept-61093,2017-04-28 00:30:00,26,2,4,26,0,0,0,0,0
1375307999395597_1871394189786973,It is said that O Panneerselvam has submitted more documents in the first round for the 'two leaves' symbol.,"Nanjil Sampath claims 87 MLAs support TTV, dist. secys asked to submit affidavit in favour of Sasikala",link,http://www.thenewsminute.com/article/nanjil-sampath-claims-87-mlas-support-ttv-dist-secys-asked-submit-affidavit-favour-sasikala,2017-04-28 00:15:00,26,0,1,21,1,0,4,0,0
1375307999395597_1871039663155759,"When Goswami went on Reddit to answer questions about his investors, nationalism and a lot more.","Indians should be pro-military and pro India, even if that makes us right wing: Arnab Goswami",link,http://www.thenewsminute.com/article/indians-should-be-pro-military-and-pro-india-even-if-makes-us-right-wing-arnab-goswami-61111,2017-04-28 00:10:00,241,16,36,196,16,1,21,1,6
1375307999395597_1870984149827977,Honking unnecessarily on the roads is common but don't let that make you believe you can get away with it.,"Horn not OK please: Honking without reason is illegal, so we might as well stop it",link,http://www.thenewsminute.com/article/horn-not-ok-please-honking-without-reason-illegal-so-we-might-well-stop-it-61098,2017-04-28 00:00:00,6,0,0,6,0,0,0,0,0
1375307999395597_1871383816454677,Radhakrishnan acknowledged that the definition of reusable hospital linen and ways of treating it in the present law were unclear.,Tamil Nadu to be the first state with a policy on washing of hospital linen,link,http://www.thenewsminute.com/article/tamil-nadu-be-first-state-policy-washing-hospital-linen-61125,2017-04-27 23:35:00,28,0,2,27,1,0,0,0,0
1375307999395597_1871380519788340,"According to reports, BBMP has not only imposed fine on the contractor, but has also suspended the concerned health officer.","In a first, Bengaluru contractor slapped with Rs 5 lakh fine for polluting Bellandur lake",link,http://www.thenewsminute.com/article/first-bengaluru-contractor-slapped-rs-5-lakh-fine-polluting-bellandur-lake-61124,2017-04-27 23:30:00,364,11,64,313,20,3,22,4,2
1375307999395597_1871057286487330,"In many parts of the city, water has not been supplied for a week, and even daily tasks have become an incredible struggle.","The drought is so bad in Thiruvananathapuram, many don't even have water to wash themselves",link,http://www.thenewsminute.com/article/drought-so-bad-thiruvananathapuram-many-don-t-even-have-water-wash-themselves-61113,2017-04-27 23:20:00,22,0,4,17,0,1,0,4,0
1375307999395597_1871373116455747,"This came just a day after Naidu's son and Andhra Pradesh Minister, Nara Lokesh, expressed doubts on Modi's proposal.","Andhra CM Naidu supports PM Modi's 'one nation, one election' proposal",link,http://www.thenewsminute.com/article/andhra-cm-naidu-supports-pm-modis-one-nation-one-election-proposal-61122,2017-04-27 23:10:00,398,10,14,367,12,2,16,0,1
1375307999395597_1871364706456588,"The morning shows in several cinema theatres across Tamil Nadu were cancelled, much to the disappointment of fans.",Here is why 'Baahubali 2' release got delayed in Tamil Nadu,link,http://www.thenewsminute.com/article/here-why-baahubali-2-release-got-delayed-tamil-nadu-61120,2017-04-27 22:37:00,1088,18,37,1001,20,5,41,9,12
1375307999395597_1871301443129581,KCR was addressing a mammoth public meeting on the eve of the TRS' 16th formation day.,"Will not rest till we achieve 'Bangaru' Telangana, says KCR",link,http://www.thenewsminute.com/article/will-not-rest-till-we-achieve-bangaru-telangana-says-kcr-61118,2017-04-27 22:20:00,27,8,0,20,3,0,4,0,0
1375307999395597_1871295359796856,"His chemistry with Rajinjkanth in Guru Sishyan is unforgettable. But later, he was typecast in rustic roles. A #mustread article on Vinu Chakravarthy.",The man who found Silk Smitha: Vinu Chakravarthy reminded us of the classism in cinema,link,http://www.thenewsminute.com/article/man-who-found-silk-smitha-vinu-chakravarthy-reminded-us-classism-cinema-61116,2017-04-27 22:10:00,1828,42,127,1523,39,5,1,259,1
1375307999395597_1871019379824454,"""He wanted to commit suicide but he was worried about his sister and mother, so he killed them,"" the police claimed.",Chennai double murder: Police apprehend man accused of killing his mother and sister,link,http://www.thenewsminute.com/article/chennai-double-murder-police-apprehend-man-accused-killing-his-mother-and-sister-61097,2017-04-27 21:30:00,12,0,2,11,0,0,0,0,1
1375307999395597_1871018979824494,"#Replug The government's latest move would mean acquisition of at least 80,000 acres of land -- thrice Jaipur's area.",Explainer: Why the Centre's big solar push could run into a land acquisition hurdle,link,http://www.thenewsminute.com/article/explainer-why-centres-big-solar-push-could-run-land-acquisition-hurdle-59327,2017-04-27 12:30:00,8,3,0,7,0,1,0,0,0
1375307999395597_1870893886503670,"Buildings and walls in the cities of Warangal, Hanamkonda and Kazipet got a makeover earlier this month.",A Telangana Collector's gift for officials who beautified cities -- 'Baahubali 2' tickets,link,http://www.thenewsminute.com/article/telangana-collectors-gift-officials-who-beautified-cities-baahubali-2-tickets-61072,2017-04-27 12:00:00,76,0,1,74,1,1,0,0,0
1375307999395597_1871012606491798,"#Replug In an interview to TNM, Univercell's Sathish Babu recalls his early days, and the challenging years ahead for brick-and-mortar retail.",The eternal love for the sale: Why South India's mobile expert is unfazed by mighty e-retail,link,http://www.thenewsminute.com/article/eternal-love-sale-why-south-indias-mobile-expert-unfazed-mighty-e-retail-51925,2017-04-27 11:40:00,19,0,1,19,0,0,0,0,0
1375307999395597_1871027439823648,"People anywhere in the country can call AHF India's toll free number or email them, and get condoms delivered to their doorsteps.","As worldwide funding for AIDS programmes falls, India gets a free condom store",link,http://www.thenewsminute.com/article/worldwide-funding-aids-programmes-falls-india-gets-free-condom-store-61108,2017-04-27 11:20:00,18,0,1,18,0,0,0,0,0
1375307999395597_1871041339822258,"IPL has fast-tracked young Indian cricketers into international reckoning, where once the road was arduous.","If IPL was born earlier, these lesser-known Indian cricketers who would have rocked it",link,http://www.thenewsminute.com/article/if-ipl-was-born-earlier-these-lesser-known-indian-cricketers-who-would-have-rocked-it-61081,2017-04-27 11:10:00,19,0,1,19,0,0,0,0,0
1375307999395597_1870859229840469,The ad was part of Coca Cola's 'testimonial' series and shows the actor claiming that the drink is safe for consumption.,"Radikaa Sarathkumar's old Coca Cola ad goes viral, trolls have a field day",link,http://www.thenewsminute.com/article/radikaa-sarathkumars-old-coca-cola-ad-goes-viral-trolls-have-field-day-61066,2017-04-27 11:00:00,44,0,3,31,1,1,10,0,1
1375307999395597_1871039476489111,"When Goswami went on Reddit to answer questions about his investors, nationalism and a lot more.","Indians should be pro-military and pro India, even if that makes us right wing: Arnab Goswami",link,http://www.thenewsminute.com/article/indians-should-be-pro-military-and-pro-india-even-if-makes-us-right-wing-arnab-goswami-61111,2017-04-27 10:20:00,2474,134,269,2098,162,9,184,4,17
1375307999395597_1870973263162399,The absurd interest in Emmanuel Macron's personal life would have one believe that he indulges in Roman style orgies every day.,"French presidential candidate Macron is 39, his wife 64: Why do we find this so hard to accept?",link,http://www.thenewsminute.com/article/french-presidential-candidate-macron-39-his-wife-64-why-do-we-find-so-hard-accept-61093,2017-04-27 10:10:00,179,19,16,150,5,2,21,0,1
1375307999395597_1871056086487450,"In many parts of the city, water has not been supplied for a week, and even daily tasks have become an incredible struggle.","The drought is so bad in Thiruvananathapuram, many don't even have water to wash themselves",link,http://www.thenewsminute.com/article/drought-so-bad-thiruvananathapuram-many-don-t-even-have-water-wash-themselves-61113,2017-04-27 09:59:49,510,22,188,344,1,1,2,147,15
1375307999395597_1871033159823076,Venkitachalam says that many people who had invited his family for their weddings later withdrew their invitations following the threats from the community leaders.,"For disobeying community leaders, this Kerala family has been ostracised for five years",link,http://www.thenewsminute.com/article/disobeying-community-leaders-kerala-family-has-been-ostracised-five-years-61109,2017-04-27 09:40:00,22,0,0,21,0,1,0,0,0
1375307999395597_1869451466647912,"""Trains are like the veins of this country, they are a platform to enter people's lives. Every passenger is a story..."" #IndianRailways",Window Seat Project: This Instagram page will have you yearning to travel by train again,link,http://www.thenewsminute.com/article/window-seat-project-instagram-page-will-have-you-yearning-travel-train-again-60900,2017-04-27 09:30:00,13,0,1,13,0,0,0,0,0
1375307999395597_1870980399828352,Honking unnecessarily on the roads is common but don't let that make you believe you can get away with it.,"Horn not OK please: Honking without reason is illegal, so we might as well stop it",link,http://www.thenewsminute.com/article/horn-not-ok-please-honking-without-reason-illegal-so-we-might-well-stop-it-61098,2017-04-27 09:15:00,52,0,2,52,0,0,0,0,0
1375307999395597_1871029569823435,"Ride your cycle in the mountains, from the comfort of your home! Watch this to know how.","Ride your cycle in the mountains, from the comfort of your hom...",video,https://www.facebook.com/TheNewsMinute/videos/1871029569823435/,2017-04-27 09:11:11,31,2,18,27,0,4,0,0,0
1375307999395597_1870995136493545,"Celebrating the 60th anniversary of the first cabinet meeting, leaders came together to urge that legislators focus on development.","Kerala Speaker unimpressed with MLAs' performance, says consensus needed on development",link,http://www.thenewsminute.com/article/kerala-speaker-unimpressed-mlas-performance-says-consensus-needed-development-61063,2017-04-27 09:00:00,2,0,0,2,0,0,0,0,0
1375307999395597_1870993903160335,Sajitha hopes to use the grant to preserve her work against the ravages of Kerala's humidity.,Kerala artist bags prestigious grant for painting the politics around women's bodies,link,http://www.thenewsminute.com/article/kerala-artist-bags-prestigious-grant-painting-politics-around-womens-bodies-61102,2017-04-27 08:45:00,19,0,0,19,0,0,0,0,0
1375307999395597_1870985086494550,"With no sponsors or government support, this India team is not even able to cover the airfare to France.",These players from Chennai need your help to represent India in the frisbee World Championship,link,http://www.thenewsminute.com/article/these-players-chennai-need-your-help-represent-india-frisbee-world-championship-61100,2017-04-27 08:30:00,65,2,16,60,0,0,0,5,0
1375307999395597_1871009693158756,Kodinhi: A Kerala village with 400 pairs of twins that continues to be a mystery to researchers,Kodinhi: A Kerala village with 400 pairs of twins that continues to be a mystery to researchers,link,http://mailchi.mp/thenewsminute/kodinhi-a-kerala-village-with-400-pairs-of-twins-that-continues-to-be-a-mystery-to-researchers,2017-04-27 08:29:41,8,0,0,5,0,3,0,0,0
1375307999395597_1870978423161883,"""He wanted to commit suicide but he was worried about his sister and mother, so he killed them,"" the police claimed.",Chennai double murder: Police apprehend man accused of killing mother and sister,link,http://www.thenewsminute.com/article/chennai-double-murder-police-apprehend-man-accused-killing-mother-and-sister-61097,2017-04-27 07:16:54,11,1,0,9,0,0,0,0,2
1375307999395597_1870951796497879,"More than 3,000 people are killed in road accidents every year in the state, the AP's Home Minister said.",'War on road accidents' declared in AP one week after 15 people die in Chittoor,link,http://www.thenewsminute.com/article/war-road-accidents-declared-ap-one-week-after-15-people-die-chittoor-61088,2017-04-27 05:48:00,14,1,0,11,1,0,0,2,0
1375307999395597_1870948786498180,A scuffle erupted after Yeddyurappa loyalist Puttaswamy took exception to criticism of the party President by MLC Bhanuprakash.,Karnataka BJP feud erupts again: Yeddyurappa supporters forced out of Eshwarappa faction event,link,http://www.thenewsminute.com/article/karnataka-bjp-feud-erupts-again-yeddyurappa-supporters-forced-out-eshwarappa-faction-event,2017-04-27 05:23:37,12,1,0,9,0,1,2,0,0
