status_id,status_message,link_name,status_type,status_link,status_published,num_reactions,num_comments,num_shares,num_likes,num_loves,num_wows,num_hahas,num_sads,num_angrys
1375307999395597_1870938493165876,"IPL has fast-tracked young Indian cricketers into international reckoning, where once the road was arduous.","If IPL was born earlier, these lesser-known Indian cricketers who would have rocked it",link,http://www.thenewsminute.com/article/if-ipl-was-born-earlier-these-lesser-known-indian-cricketers-who-would-have-rocked-it-61081,2017-04-27 05:15:00,38,5,4,38,0,0,0,0,0
1375307999395597_1870933193166406,An international team of genetic researchers are trying to find the answer to this bizarre phenomenon.,Kodinhi: A Kerala village with 400 pairs of twins that continues to be a mystery to researchers,link,http://www.thenewsminute.com/article/kodinhi-kerala-village-400-pairs-twins-continues-be-mystery-researchers-61083,2017-04-27 05:00:00,2341,39,464,2052,50,219,19,1,0
1375307999395597_1870916099834782,OPS said that the murder made people question the law and order situation in the state.,Murder at Jayalalithaa estate raises many doubts: OPS and Stalin want probe,link,http://www.thenewsminute.com/article/murder-jayalalithaa-estate-raises-many-doubts-ops-and-stalin-want-probe-61076,2017-04-27 04:00:00,79,0,7,77,2,0,0,0,0
1375307999395597_1870893533170372,"Buildings and walls in the cities of Warangal, Hanamkonda and Kazipet got a makeover earlier this month.",A Telangana Collector's gift for officials who beautified cities -- 'Baahubali 2' tickets,link,http://www.thenewsminute.com/article/telangana-collectors-gift-officials-who-beautified-cities-baahubali-2-tickets-61072,2017-04-27 03:00:00,122,0,6,120,1,1,0,0,0
1375307999395597_1870859073173818,The ad was part of Coca Cola's 'testimonial' series and shows the actor claiming that the drink is safe for consumption.,"Radikaa Sarathkumar's old Coca Cola ad goes viral, trolls have a field day",link,http://www.thenewsminute.com/article/radikaa-sarathkumars-old-coca-cola-ad-goes-viral-trolls-have-field-day-61066,2017-04-27 01:45:00,985,22,45,557,4,3,319,2,100
1375307999395597_1870854926507566,Chennai: India's Sunyana Kuruvilla celebrates after beating Koreas Choe Yura at the 19th Asian Squash Championships in Chennai on Wednesday. Pakistan Squash Federation (PSF) has decided to withdraw its participation due to refusal of visas. (PTI Photo by R Senthil Kumar),Timeline Photos,photo,https://www.facebook.com/TheNewsMinute/photos/a.1404987593094304.1073741828.1375307999395597/1870854926507566/?type=3,2017-04-27 01:18:33,546,2,13,523,15,7,0,0,1
1375307999395597_1870854756507583,Chennai: India's Sunyana Kuruvilla and Koreas Choe Yura in action during their match at the 19th Asian Squash Championships in Chennai on Wednesday. Pakistan Squash Federation (PSF) has decided to withdraw its participation due to refusal of visas. (PTI Photo by R Senthil Kumar),Timeline Photos,photo,https://www.facebook.com/TheNewsMinute/photos/a.1404987593094304.1073741828.1375307999395597/1870854756507583/?type=3,2017-04-27 01:17:42,20,0,0,20,0,0,0,0,0
1375307999395597_1870441599882232,"If the accusations are proven true, Chetan Bhagat may join the ranks of Kaavya Viswanathan and Jonah Lehrer.",Not just Chetan Bhagat: Three other high-profile allegations of plagiarism and fraud,link,http://www.thenewsminute.com/article/not-just-chetan-bhagat-three-other-high-profile-allegations-plagiarism-and-fraud-61024,2017-04-27 00:00:00,4,0,0,4,0,0,0,0,0
1375307999395597_1870829609843431,The IPS officer had promised that he could delay the issue of a summon to Dhinakaran.,Did a senior IPS officer from TN attempt to help TTV Dhinakaran in the ECI bribery case?,link,http://www.thenewsminute.com/article/did-senior-ips-officer-tn-attempt-help-ttv-dhinakaran-eci-bribery-case-61057,2017-04-26 23:48:51,32,2,0,31,0,1,0,0,0
1375307999395597_1870810796511979,"While addressing a public meeting in Idukki district on April 22, Mani had said that the women plantation workers were into ""drinks and much else"".",CPI-M to publicly censure MM Mani for his 'curt remarks',link,http://www.thenewsminute.com/article/cpi-m-publicly-censure-mm-mani-his-curt-remarks-61054,2017-04-26 23:01:29,5,0,4,5,0,0,0,0,0
1375307999395597_1870810289845363,The child rights commission had received multiple complaints from parents against schools conducting classes during vacation.,"Karnataka Child rights commission cracks down on summer 'special' classes, seeks action against schools",link,http://www.thenewsminute.com/article/karnataka-child-rights-commission-cracks-down-summer-special-classes-seeks-action-against,2017-04-26 22:59:12,13,0,4,11,0,2,0,0,0
1375307999395597_1870797576513301,"Lokesh also added that he was confident of the TDP retaining power, if elections were held.","Nara Lokesh rejects Modi's idea of holding state and general polls together, says no one will agree",link,http://www.thenewsminute.com/article/nara-lokesh-rejects-modis-idea-holding-state-and-general-polls-together-says-no-one-will,2017-04-26 22:40:00,29,11,1,26,0,0,3,0,0
1375307999395597_1870787129847679,It was also reported that the sanctum sanctorum was opened on that day against the rules.,"Women of menstruating age did not enter Sabarimala, Devaswom Vigilance report states",link,http://www.thenewsminute.com/article/women-menstruating-age-did-not-enter-sabarimala-devaswom-vigilance-report-states-61049,2017-04-26 21:45:25,8,0,0,8,0,0,0,0,0
1375307999395597_1870779009848491,"Two people from the orphanage were arrested last week, after a video of the incident surfaced.","CWC to visit orphanage that made HIV positive minors clean manhole in Hyderabad, meeting held",link,http://www.thenewsminute.com/article/cwc-visit-orphanage-made-hiv-positive-minors-clean-manhole-hyderabad-meeting-held-61047,2017-04-26 21:30:00,11,0,4,11,0,0,0,0,0
1375307999395597_1870778869848505,The President also voiced concern that Indian universities were lagging far behind in basic research and innovation.,"Hyderabad's last Nizam Osman Ali Khan was a visionary, says Prez Pranab Mukherjee",link,http://www.thenewsminute.com/article/hyderabads-last-nizam-osman-ali-khan-was-visionary-says-prez-pranab-mukherjee-61048,2017-04-26 21:15:39,14,0,1,13,1,0,0,0,0
1375307999395597_1868929723366753,What if you are were told that the plastic you just threw away could possibly end up on your plate?,Watch: What really happens to the plastic we throw away,link,http://www.thenewsminute.com/article/watch-what-really-happens-plastic-we-throw-away-60842,2017-04-26 12:36:07,7,1,1,6,1,0,0,0,0
1375307999395597_1870522099874182,A person taking care of patients suffering from burns should be extremely careful and mentally strong.,"Nurses in burn units, undeterred by scorched flesh and disfigured faces",link,http://www.thenewsminute.com/article/nurses-burn-units-undeterred-scorched-flesh-and-disfigured-faces-51253,2017-04-26 12:24:49,43,0,3,40,1,0,0,2,0
1375307999395597_1870521819874210,"#Replug Beyond Dulquer's good looks and talent, he's managed to do something quite stupendous: make the audience forget that he's Mammooty's son.",The Dulquer Salmaan example: Lessons for star kids on making it big,link,http://www.thenewsminute.com/article/dulquer-salmaan-example-lessons-star-kids-making-it-big-51312,2017-04-26 12:07:02,789,14,42,736,45,6,1,0,1
1375307999395597_1870412109885181,"Earlier, Saina had said that she would like actor Deepika Padukone to play her on screen.",Shraddha Kapoor to play badminton ace Saina Nehwal in biopic,link,http://www.thenewsminute.com/article/shraddha-kapoor-play-badminton-ace-saina-nehwal-biopic-61015,2017-04-26 12:00:00,52,0,0,48,2,1,1,0,0
1375307999395597_1870491683210557,"#Replug Dr Yadav has a bank of over 1,500 medical and surgical videos which have garnered millions of views till date.","King of Cysts: This doc's YouTube videos on popping zits, blackheads are a craze online",link,http://www.thenewsminute.com/article/king-cysts-docs-youtube-videos-popping-zits-blackheads-are-craze-online-44886,2017-04-26 11:55:03,24,0,3,24,0,0,0,0,0
1375307999395597_1870499649876427,"P Alagupandi's family was heartbroken when the news of his death arrived, a month before he was to visit them.","His elder son was killed in Maoist encounter, but TN man is still sending younger son to army",link,http://www.thenewsminute.com/article/his-elder-son-was-killed-maoist-encounter-tn-man-still-sending-younger-son-army-61016,2017-04-26 10:26:54,244,6,42,188,29,15,0,12,0
1375307999395597_1870309486562110,Does Baahubali's sword have something to do with it? Or is it the lion helmet?,Why did Kattappa kill Baahubali? Here are our theories!,link,http://www.thenewsminute.com/article/why-did-kattappa-kill-baahubali-here-are-our-theories-61004,2017-04-26 10:00:00,15,0,0,12,0,1,2,0,0
1375307999395597_1870313579895034,"""The service charge column in the bill should be left blank and must clearly display it is voluntary""","Karnataka, service charge is now totally voluntary if you're dining out",link,http://www.thenewsminute.com/article/bengaluru-service-charge-now-totally-voluntary-if-you-re-dining-out-61007,2017-04-26 09:52:32,15,0,0,15,0,0,0,0,0
1375307999395597_1870533479873044,"The confusion that arises out of decades of improper copyright agreements, out in the open now?","After SPB-Ilaiyaraaja, Sony Music and Sun Network lock horns over copyrights",link,http://www.thenewsminute.com/article/after-spb-ilaiyaraaja-sony-music-and-sun-network-lock-horns-over-copyrights-61044,2017-04-26 09:44:18,20,0,2,19,1,0,0,0,0
1375307999395597_1870512103208515,"From the RSS and Bajrang Dal to leading the Shiv Sena in Karnataka, Pramod Muthalik's Hindutva journey.",What led Pramod Muthalik to join the Ram Sene? The story of Hindutva's Karnataka face,link,http://www.thenewsminute.com/article/what-led-pramod-muthalik-join-ram-sene-story-hindutvas-karnataka-face-61028,2017-04-26 09:25:09,9,1,1,6,1,1,1,0,0
1375307999395597_1870523479874044,"To understand what's happening in the AIADMK today, we must understand the history of #Dhivaharan vs #TTV.","Sasikala and TTV in jail, but the Mannargudi family could still be winning: Here's why",link,http://www.thenewsminute.com/article/sasikala-and-ttv-jail-mannargudi-family-could-still-be-winning-heres-why-61043,2017-04-26 09:15:33,729,34,202,636,8,6,50,2,27
1375307999395597_1870482823211443,They have also identified 38 trees on the Sarjapur Circle-Attibele Circle stretch that can be relocated.,Sarjapur residents are crowdfunding to translocate trees that will be cut down to widen roads,link,http://www.thenewsminute.com/article/sarjapur-residents-are-crowdfunding-translocate-trees-will-be-cut-down-widen-roads-61031,2017-04-26 08:53:39,35,0,9,31,3,1,0,0,0
1375307999395597_1870514636541595,"The drainage system the worker was repairing filled with water, leading to the worker calling for help","Chennai Metro Water sends worker into manhole, braveheart who followed in to save him dies",link,http://www.thenewsminute.com/article/chennai-metro-water-sends-worker-manhole-braveheart-who-followed-save-him-dead-61040,2017-04-26 08:45:46,222,3,29,94,1,3,0,86,38
1375307999395597_1870484503211275,"Anti-liquor protests are not new to Tamil Nadu, but the scale and intensity of protests have grown greatly in recent months.",When govt runs the liquor business: Why TN is erupting now in anger against its TASMAC shops,link,http://www.thenewsminute.com/article/when-govt-runs-liquor-business-why-tn-erupting-now-anger-against-its-tasmac-shops-61032,2017-04-26 08:35:36,132,4,14,119,10,1,2,0,0
1375307999395597_1870489313210794,"Soon enough, trolls began using celebrity and journalist photos supporting the campaign to spread their own mocking messages.","Sonam Kapoor, Barkha Dutt observe 'Anti Trolling Day', but get trolled for that too",link,http://www.thenewsminute.com/article/sonam-kapoor-barkha-dutt-observe-anti-trolling-day-get-trolled-too-61036,2017-04-26 08:17:58,78,3,4,31,5,0,38,1,3
1375307999395597_1870482129878179,"""Corrective action will be taken as per company policy and after due investigation,"" the airliner said.","Harbhajan tweets about 'racist' foreign pilot, Jet Airways issues apology, assures action",link,http://www.thenewsminute.com/article/harbhajan-tweets-about-racist-foreign-pilot-jet-airways-issues-apology-assures-action-61034,2017-04-26 08:01:28,59,1,2,58,0,0,1,0,0
1375307999395597_1870481009878291,The team have built a system that uses AI chatterbots to automatically detect and flag racism and sexism on Twitter.,"Tired of racist, sexist comments on Twitter? These IIIT-Hyderabad researchers have the answer",link,http://www.thenewsminute.com/article/tired-racist-sexist-comments-twitter-these-iiit-hyderabad-researchers-have-answer-61030,2017-04-26 07:33:33,66,0,5,58,4,4,0,0,0
1375307999395597_1870441516548907,"If the accusations are proven true, Chetan Bhagat may join the ranks of Kaavya Viswanathan and Jonah Lehrer.",Not just Chetan Bhagat: Three other high-profile allegations of plagiarism and fraud,link,http://www.thenewsminute.com/article/not-just-chetan-bhagat-three-other-high-profile-allegations-plagiarism-and-fraud-61024,2017-04-26 06:30:00,25,0,0,23,0,0,2,0,0
1375307999395597_1870429803216745,"Northern white rhinos have been native to wild central Africa, but survival of the species is in peril due to excessive poaching.","The world's last male northern white rhino is on Tinder, and you better swipe right",link,http://www.thenewsminute.com/article/worlds-last-male-northern-white-rhino-tinder-and-you-better-swipe-right-61019,2017-04-26 05:54:03,13,0,1,13,0,0,0,0,0
1375307999395597_1870429899883402,A German couple is suing because Facebook won't grant them access to their dead daughter's account.,What happens to your Facebook account after you die?,link,http://www.thenewsminute.com/article/what-happens-your-facebook-account-after-you-die-61020,2017-04-26 05:51:08,22,0,2,20,0,0,2,0,0
1375307999395597_1870417839884608,"P Alagupandi's family was heartbroken when the news of his death arrived, a month before he was to visit them.","His elder son was killed in Maoist encounter, but TN man is still sending younger son to army",link,http://www.thenewsminute.com/article/his-elder-son-was-killed-maoist-encounter-tn-man-still-sending-younger-son-army-61016,2017-04-26 05:10:00,1424,20,187,1137,134,17,1,134,1
1375307999395597_1870411596551899,"The Bollywood actor tweeted on Wednesday that she was ""honoured"" to play Saina in the new film.",Shraddha Kapoor to play badminton ace Saina Nehwal in biopic,link,http://www.thenewsminute.com/article/shraddha-kapoor-play-badminton-ace-saina-nehwal-biopic-61015,2017-04-26 04:46:20,61,3,3,57,1,1,1,0,1
1375307999395597_1870380539888338,"Vishwanath said that CM Siddaramaiah did not consult with him, although he was a senior leader of the party with a strong base in Mysuru.",Karnataka Congress faces another defection? Veteran leader H Vishwanath may quit the party,link,http://www.thenewsminute.com/article/karnataka-congress-faces-another-defection-veteran-leader-h-vishwanath-may-quit-party-61014,2017-04-26 04:41:36,15,0,0,15,0,0,0,0,0
1375307999395597_1870330209893371,"KTR has also unveiled plans to rejuvenate the lake, which is now a stinking mess, covered with water hyacinth.",Hyderabad to get a suspension bridge across Durgam Cheruvu by 2019,link,http://www.thenewsminute.com/article/hyderabad-get-suspension-bridge-across-durgam-cheruvu-2019-61012,2017-04-26 04:07:39,16,2,3,16,0,0,0,0,0
1375307999395597_1870319283227797,"The online portals of at least 10 educational institutes were hacked allegedly by a Pakistani group, reports say.","Hackers target DU, IIT, AMU websites, say it's for 'Kashmiris killed by Indian army'",link,http://www.thenewsminute.com/article/hackers-target-du-iit-amu-websites-say-its-kashmiris-killed-indian-army-61010,2017-04-26 03:28:43,6,0,1,4,0,0,1,0,1
1375307999395597_1870315973228128,The incident happened when Shobu and the Baahubali team were headed back to Hyderabad from Dubai.,"Baahubali producer accuses Emirates staffer of racism, alleges harassment",link,http://www.thenewsminute.com/article/baahubali-producer-accuses-emirates-staffer-racism-alleges-harassment-61008,2017-04-26 03:25:51,97,1,6,91,1,1,1,0,3
1375307999395597_1870313096561749,The Karnataka government has asked eateries to display 'No service charge will be collected here' boards.,"Karnataka, service charge is now totally voluntary if you're dining out",link,http://www.thenewsminute.com/article/bengaluru-service-charge-now-totally-voluntary-if-you-re-dining-out-61007,2017-04-26 02:44:00,46,0,2,44,1,1,0,0,0
1375307999395597_1870309309895461,Does Baahubali's sword have something to do with it? Or is it the lion helmet?,Why did Kattappa kill Baahubali? Here are our theories!,link,http://www.thenewsminute.com/article/why-did-kattappa-kill-baahubali-here-are-our-theories-61004,2017-04-26 02:32:16,35,8,3,26,1,0,4,0,4
1375307999395597_1870306136562445,"The tiny protester of Tamil Nadu: Meet 7-yr-old Akash, who shut down a wine shop for 2 hours.",,video,https://www.facebook.com/TheNewsMinute/videos/1870306136562445/,2017-04-26 02:23:07,192,1,54,176,13,2,1,0,0
1375307999395597_1870287063231019,"""No matter which button one presses, the vote goes in BJP's favour,"" AAP leader Ashutosh alleged.","After BJP's landslide win in Delhi civic polls, AAP alleges EVM tampering",link,http://www.thenewsminute.com/article/after-bjps-landslide-win-delhi-civic-polls-aap-alleges-evm-tampering-61003,2017-04-26 02:02:46,142,22,10,78,1,0,59,1,3
1375307999395597_1870286463231079,Alifarm is a mobile gardening concept that offers a convenient way of gardening for urban dwellers.,"Backyard farms are pass, this startups helps you build a farm in your bedroom",link,http://www.thenewsminute.com/article/backyard-farms-are-pass-startups-helps-you-build-farm-your-bedroom-61002,2017-04-26 01:35:00,16,0,3,16,0,0,0,0,0
1375307999395597_1870278689898523,"The Chief Minister said that under the guise of drill exercises, the RSS was giving arms training in schools and temples.","RSS teaching kids to kill, trying to create communal hatred in Kerala: CM Pinarayi Vijayan",link,http://www.thenewsminute.com/article/rss-teaching-kids-kill-trying-create-communal-hatred-kerala-cm-pinarayi-vijayan-61000,2017-04-26 01:19:14,507,76,262,358,9,3,72,13,52
1375307999395597_1870283956564663,Kolkata: A White Tiger beats the heat at a pond at Alipore Zoological Garden in Kolkata. (PTI Photo by Swapan Mahapatra),TheNewsMinute's cover photo,photo,https://www.facebook.com/TheNewsMinute/photos/a.1395151570744573.1073741827.1375307999395597/1870283743231351/?type=3,2017-04-26 01:17:55,139,0,1,130,7,2,0,0,0
1375307999395597_1870256153234110,M Padmanabhan from Thiruvarur had already opted for voluntary retirement and was to be relieved from his duty on May 31.,TN govt sanctions Rs 20 lakh for families of four CRPF personnel killed in Maoist attack,link,http://www.thenewsminute.com/article/tn-govt-sanctions-rs-20-lakh-families-four-crpf-personnel-killed-maoist-attack-60996,2017-04-25 23:50:03,123,0,1,108,1,0,0,14,0
1375307999395597_1870247339901658,"This is the fourth woman to die in the city, in the past one week, after a C-section delivery.",Hyderabad sees another C-section death: Woman dies in Niloufer hospital due to respiratory problems,link,http://www.thenewsminute.com/article/hyderabad-sees-another-c-section-death-woman-dies-niloufer-hospital-due-respiratory-problems,2017-04-25 23:40:00,34,0,2,21,0,0,0,11,2
1375307999395597_1869974449928947,"Dr Mahadevan has been treating HIV-positive persons for long, and donates a large portion of his fee to various causes.","This Coimbatore doctor asks no fee from patients, tells them give whatever you wish",link,http://www.thenewsminute.com/article/man-golden-heart-coimbatore-doctor-tells-his-patients-pay-what-they-want-60977,2017-04-25 23:23:33,120,0,58,113,7,0,0,0,0
1375307999395597_1870230556570003,"The state plans to shift 'Dharna Chowk', a popular venue of protests, to the outskirts of Hyderabad.",Hyderabad HC asks Telangana govt to explain stand on shifting 'Dharna Chowk' from Indira Park,link,http://www.thenewsminute.com/article/hyderabad-hc-asks-telangana-govt-explain-stand-shifting-dharna-chowk-indira-park-60988,2017-04-25 23:19:42,7,0,0,7,0,0,0,0,0
1375307999395597_1870227456570313,"There are several instances where the show blames Pakistan for the Kashmir crisis without taking alternative viewpoints into account, the report says.","Times Now slammed by UK TV regulator for biased Indo-Pak coverage, channel blames Arnab",link,http://www.thenewsminute.com/article/times-now-slammed-uk-tv-regulator-biased-indo-pak-coverage-channel-blames-arnab-60985,2017-04-25 22:30:00,7229,214,278,6654,30,14,415,8,108
1375307999395597_1870222993237426,"The HC has now asked the state government what action it has taken on the incident, and adjourned the case to June 13.",Hyderabad HC issues notice to TDP MP Kesineni Nani and others over clash with bureaucrat,link,http://www.thenewsminute.com/article/hyderabad-hc-issues-notice-tdp-mp-kesineni-nani-and-others-over-clash-bureaucrat-60984,2017-04-25 22:20:00,9,0,0,9,0,0,0,0,0
1375307999395597_1870227693236956,"#Breaking - The move came just hours after TTV Dhinakaran, Sasikala's nephew, was arrested by the police for attempting to bribe ECI officials.",Sasikala banners pulled down at AIADMK HQ: Is it the end of Mannargudi control?,link,http://www.thenewsminute.com/article/sasikala-banners-pulled-down-aiadmk-hq-it-end-mannargudi-control-60986,2017-04-25 22:10:33,1809,27,126,1477,52,14,261,0,5
1375307999395597_1870213246571734,"""So what if she is Gujarati? I too am Gujarat's son-in-law,"" he said.","Former Gujarat CM Anandiben best candidate for President, says Subramanian Swamy",link,http://www.thenewsminute.com/article/former-gujarat-cm-anandiben-best-candidate-president-says-subramanian-swamy-60983,2017-04-25 22:10:00,84,11,2,46,2,0,30,0,6
1375307999395597_1869959703263755,"Seven-year-old Aakash and other students submitted a petition with 1,200 signatures demanding the wine shop's closure.",Tamil Nadu's 'justice league' of school kids come together to shut down liquor shop,link,http://www.thenewsminute.com/article/tamil-nadus-justice-league-school-kids-come-together-shut-down-liquor-shop-60972,2017-04-25 22:00:00,10,1,0,10,0,0,0,0,0
1375307999395597_1869962079930184,The TN government was attempting to bring certain national and state highways under local bodies to circumvent the SC ban.,Let highway TASMAC shops remain shut for next 3 months: Madras HC to TN government,link,http://www.thenewsminute.com/article/let-highway-tasmac-shops-remain-shut-next-3-months-madras-hc-tn-government-60968,2017-04-25 21:40:00,13,0,0,11,1,0,1,0,0
1375307999395597_1869908986602160,Shek Monu lost his legs and arm when he accidentally touched a live electric wire when he was just seven years old.,"This amputee rapper from Hyderabad needs a new wheelchair, and you can help",link,http://www.thenewsminute.com/article/amputee-rapper-hyderabad-needs-new-wheelchair-and-you-can-help-60961,2017-04-25 20:38:08,11,1,4,9,0,0,0,2,0
1375307999395597_1870097629916629,"#Breaking The arrest comes after several hours of interrogation on Saturday, Sunday, Monday and Tuesday. Crime branch Delhi arrests T.T.V Dhinakaran.",TTV Dhinakaran arrested in New Delhi for attempting to bribe EC officials for AIADMK symbol,link,http://www.thenewsminute.com/article/ttv-dhinakaran-arrested-new-delhi-attempting-bribe-ec-officials-aiadmk-symbol-60982,2017-04-25 13:40:12,1318,32,145,1009,23,34,243,2,7
1375307999395597_1869993893260336,The invention of the flush toilet was probably one of the most unsustainable innovations in human history.,"The world needs more toilets, but not ones that flush",link,http://www.thenewsminute.com/article/world-needs-more-toilets-not-ones-flush-59042,2017-04-25 12:30:00,78,5,15,74,1,1,1,0,1
1375307999395597_1869959449930447,"Seven-year-old Aakash and other students submitted a petition with 1,200 signatures demanding the wine shop's closure.",Tamil Nadu's 'justice league' of school kids come together to shut down liquor shop,link,http://www.thenewsminute.com/article/tamil-nadus-justice-league-school-kids-come-together-shut-down-liquor-shop-60972,2017-04-25 12:00:00,52,6,5,46,3,1,2,0,0
1375307999395597_1869988533260872,"600,000 litres of blood wasted in five years in India, Rape victims in the U.S. made to pay part of the medical bill, and more.","The World Health Minute: Rs 600 cap on dengue, malaria tests; first new antibiotic in decades developed",link,http://www.thenewsminute.com/article/world-health-minute-rs-600-cap-dengue-malaria-tests-first-new-antibiotic-decades-developed,2017-04-25 11:33:31,23,0,1,21,0,0,0,0,2
1375307999395597_1869992989927093,"#Replug Names areas after rivers, factories, local vegetation and the common business, Chennai has it all.",Does Thousand Lights in Chennai really have a 1000 lights? How city's areas got their names,link,http://www.thenewsminute.com/article/does-thousand-lights-chennai-really-have-1000-lights-how-citys-areas-got-their-names-52151,2017-04-25 11:15:00,70,1,6,68,2,0,0,0,0
1375307999395597_1869871029939289,"While the RBI has clearly stated the coins are valid, some traders and customers are still not willing to accept them.","No matter what RBI says, many vendors are still rejecting Rs 10 coins",link,http://www.thenewsminute.com/article/no-matter-what-rbi-says-many-vendors-are-still-rejecting-rs-10-coins-60951,2017-04-25 10:48:55,227,2,84,208,2,1,3,1,12
1375307999395597_1870015833258142,A TN govt-school teacher sold her jewellery to give students a classroom they deserve. Meet her.,Meet this TN govt-school teacher sold her jewellery to give st...,video,https://www.facebook.com/TheNewsMinute/videos/1870015833258142/,2017-04-25 10:01:28,8344,227,4583,7492,505,328,14,3,2
