status_id,status_message,link_name,status_type,status_link,status_published,num_reactions,num_comments,num_shares,num_likes,num_loves,num_wows,num_hahas,num_sads,num_angrys
10606591490_10154660452666491,"""This is an unacceptable guest experience and the Fyre team takes full responsibility for the issues that occurred.""",Fyre Festival Promises Refunds as 'Luxury' Event Turns to Chaos,link,http://ti.me/2qivsvD,2017-04-29 09:00:35,13,0,1,12,0,0,1,0,0
10606591490_10154660346546491,"Kayla Itsines: ""I want women to work out because they love their body, not because they hate it.""",Kayla Itsines on the Quickest Way to Get Fit,link,http://ti.me/2pqtMlZ,2017-04-29 08:01:11,168,6,14,156,11,1,0,0,0
10606591490_10154547930436463,Why this North Carolina coffee shop is one of the most welcoming places you'll ever visit: http://trib.al/FN99eLA,Southern Made: Bitty & Beau's Coffee Shop,video,https://www.facebook.com/time/videos/10154547930436463/,2017-04-29 07:30:00,1109,50,315,795,305,7,1,1,0
10606591490_10155334786139073,"Dangling some 100 feet over the rocky waters of the Atlantic Ocean, the rope bridge takes visitors across cliffs where they can access the tiny island of Carrick-a-Rede.

See more photos: http://tandl.me/2pIfH41",This Rope Bridge Is So Popular You Need a Ticket to Cross,video,https://www.facebook.com/time/videos/10155334786139073/,2017-04-29 06:30:00,354,61,103,318,15,19,2,0,0
10606591490_10154659404691491,"Technology might be rewriting the rules of dating, but the game itself is a very old pursuit.",Millennials in Love: Why They're Not So Different From Their Parents After All,link,http://ti.me/2oR8kTk,2017-04-28 22:30:29,185,8,20,167,10,2,6,0,0
10606591490_10154658910671491,"Since the incident with the United passenger earlier this month, there's been a noticeable drop in their fares, according to one expert.",United Is Now Offering Crazy Cheap 'Apology Fares' to Europe,link,http://ti.me/2qgsW9n,2017-04-28 18:00:13,832,167,280,663,35,24,106,2,2
10606591490_10154658848186491,"From the inauguration crowd to discussions at Mar-a-Lago, see the most memorable moments of President Donald J. Trump's first 100 days in office.",19 Photographs That Defined Trump's First 100 Days,link,http://ti.me/2qo34aM,2017-04-28 17:30:24,192,37,18,142,9,1,22,2,16
10606591490_10154658649856491,"President Donald J. Trump calls Elizabeth Warren ""Pocahontas"" again at annual NRA convention. http://ti.me/2qnXrcx",Trump Calls Elizabeth Warren 'Pocahontas' Again,video,https://www.facebook.com/time/videos/10154658649856491/,2017-04-28 16:01:12,1627,493,168,342,23,56,135,41,1030
10606591490_10154658542731491,"The Internet is comparing the ""luxury festival"" to 'Lord of the Flies' and 'The Hunger Games.'",The 'Luxury' Fyre Music Festival Has Turned Into a 'Hunger Games for Rich People',link,http://ti.me/2ptYBpS,2017-04-28 15:00:56,1459,73,154,869,23,72,485,4,6
10606591490_10154658444631491,"TIME 100 influencers weigh in on President Donald J. Trump's first 100 days.
http://ti.me/2pu4VxA",Influencers Weigh In On Trump's First 100 Days,video,https://www.facebook.com/time/videos/10154658444631491/,2017-04-28 14:31:12,204,32,27,176,10,2,15,0,1
10606591490_10155337321424073,Here are some secrets of the beautiful island of Santorini that you might not know: http://tandl.me/2aYfRcl,Incredible Drone Footage of Santorini,video,https://www.facebook.com/time/videos/10155337321424073/,2017-04-28 10:00:00,5412,913,955,4493,818,101,1,0,0
10606591490_10154657321466491,"""We're putting in the hard work for you and giving you a pre-sweated tee for that post-workout look and smell.""",Reebok 'Sweat Shirt' Rivals Nordstrom's Mud-Caked Jeans,link,http://ti.me/2qlWe5D,2017-04-28 07:00:31,171,13,11,128,2,2,39,0,0
10606591490_10154657240931491,"President Donald J. Trump: ""This is more work than in my previous life. I thought it would be easier.""",Trump Says He Thought Being President 'Would Be Easier',link,http://ti.me/2oDCYUL,2017-04-28 06:30:41,14117,1824,3794,3924,59,1062,7937,184,953
10606591490_10154656578316491,"While his approval ratings are historically low, President Donald J. Trump supporters remain firmly planted behind their man.",Poll: Trump Voters Still Think President is Doing a Good Job,link,http://ti.me/2oOxeCV,2017-04-27 23:00:53,1968,536,91,626,39,78,875,213,137
10606591490_10154656312121491,"President Donald J. Trump: ""There is a chance that we could end up having a major, major conflict with North Korea.""",Trump Says 'Major Conflict' With North Korea Is Possible,link,http://ti.me/2qcOx2s,2017-04-27 21:30:21,1767,452,382,833,16,133,57,79,649
10606591490_10154656058746491,A history of President Donald J. Trump being trolled at the White House Correspondents' Dinner. http://ti.me/2qcKNAQ,Trump's Correspondents' Dinner History,video,https://www.facebook.com/time/videos/10154656058746491/,2017-04-27 20:01:10,1395,87,179,947,73,5,359,1,10
10606591490_10154655687996491,This may be a better way to estimate the risks of health problems associated with excess weight.,"When It Comes To Weight Loss, Forget Your BMI and Focus on This Instead",link,http://ti.me/2qcIQoa,2017-04-27 18:01:31,92,3,33,83,6,3,0,0,0
10606591490_10154655445376491,"He was known for playing hockey player Jack O'Callahan in 'Miracle,' the 2004 movie based on the U.S. men's hockey team's victory over the Soviet Union in the 1980 Olympics.","Michael Mantenuto, 'Miracle' Actor, Found Dead at 35",link,http://ti.me/2oQM8Jv,2017-04-27 16:08:59,668,50,129,244,9,35,1,376,3
10606591490_10154654924791491,Watch Robert De Niro go full millennial and try Snapchat for the first time. http://ti.me/2oAIEit,Robert De Niro Learns To Snapchat,video,https://www.facebook.com/time/videos/10154654924791491/,2017-04-27 15:30:00,6456,288,755,4388,627,9,1424,2,6
10606591490_10154655026881491,Authorities kicked a man off his Delta flight to Milwaukee after he used the bathroom while the plane was stalled on the tarmac.,Man Gets Kicked off Delta Flight for Using the Restroom,link,http://ti.me/2oQcGL8,2017-04-27 13:00:47,636,203,88,291,10,85,30,12,208
10606591490_10154654951406491,Gas shortages in North Korean capital spark rumors that China is choking supply. http://ti.me/2qap9dB,Gas Shortage in North Korea,video,https://www.facebook.com/time/videos/10154654951406491/,2017-04-27 12:31:15,827,54,238,718,19,32,55,0,3
10606591490_10154654874701491,Johansson even offered a special incentive for her newfound twin to accept her invitation to have a drink.,Scarlett Johansson Found Out She Has a Grandma Lookalike,link,http://ti.me/2oAAfvk,2017-04-27 12:00:29,631,15,8,576,32,4,19,0,0
10606591490_1290043344424968,"What is ""hygge"" and ""kalsarikannit""? And why don't these words exist in English? http://trib.al/Q46qUgR",What is Hygge and Kalsarikannit?,video,https://www.facebook.com/time/videos/1290043344424968/,2017-04-27 10:30:00,3650,406,781,3202,333,10,105,0,0
10606591490_10154913097302949,Here are Apple co-founder Steve Wozniak's predictions for the year 2075: http://for.tn/2oimpcZ,Steve Wozniak's Predictions For 2075,video,https://www.facebook.com/time/videos/10154913097302949/,2017-04-27 09:30:00,318,18,92,284,7,18,9,0,0
10606591490_10154654169701491,Ivanka Trump has advocated for female economic empowerment and said she wants this to be part of her agenda.,Ivanka Trump in Talks With World Bank On Female Entrepreneurship Fund,link,http://ti.me/2oOp8er,2017-04-27 06:30:45,501,183,26,265,14,2,135,7,78
10606591490_10154653957016491,Flight attendants for Aeroflot were told they'd been barred from international flights because of their larger clothing sizes.,Workers for Russia's Largest Airline Are Told To Lose Weight,link,http://ti.me/2oyYhqC,2017-04-27 04:00:44,884,91,80,480,9,72,115,14,194
10606591490_10154653091186491,"Anthony Bourdain won't go near plane food, but he does enjoy dining in this airport.",Anthony Bourdain Says This Airport Has the Best Food,link,http://ti.me/2qfP4Qm,2017-04-26 19:00:49,740,66,112,687,39,7,6,1,0
10606591490_10154653035841491,Compared to 52% of respondents who said that they would vote to re-elect Barack Obama after his first 100 days,Poll: Just 36% of Voters Would Re-Elect Donald Trump,link,http://ti.me/2q7MvR6,2017-04-26 18:30:20,3782,598,568,2305,174,81,1166,25,31
10606591490_10154652618736491,"From Katie Couric to Ashley Graham, see highlights from the #TIME100 photobooth. http://ti.me/2q8LtqN",TIME 100 Gala 2017 Photobooth Highlights,video,https://www.facebook.com/time/videos/10154652618736491/,2017-04-26 15:01:00,258,13,17,234,13,2,7,0,2
10606591490_10154652369351491,"John Legend is famous for his love songs, but he explains how his love for his daughter is different.",John Legend Explains Why His Daughter Hasn't Quite Earned His Love Yet,link,http://ti.me/2pA6zib,2017-04-26 14:00:11,235,24,8,209,18,0,7,0,1
10606591490_10154652132826491,"The impersonator was there to ""push back on the lies and the slander"" from Trevor Noah.",Watch This Trump Impersonator Crash 'The Daily Show',link,http://ti.me/2oMyjfd,2017-04-26 12:00:16,315,21,26,244,10,2,59,0,0
10606591490_10154651987611491,"Viola Davis on why she's telling her daughter to stop apologizing: ""We need to step into our power."" http://ti.me/2q65885 #TIME100",TIME 100 Gala 2017: Viola Davis,video,https://www.facebook.com/time/videos/10154651987611491/,2017-04-26 11:01:27,664,20,105,541,117,2,3,1,0
10606591490_10154651674611491,The 35-inch-long Continental Giant Rabbit was expected to follow in his father's footsteps and become the world's biggest bunny.,Giant Rabbit Found Dead on United Airlines Flight,link,http://ti.me/2ovGcJY,2017-04-26 08:30:12,1753,161,211,548,4,60,12,880,249
10606591490_10154651316011491,The 11-year-old was due to have his arm amputated and had already had both legs removed in a bid to save his life.,Boy in Malaysia Dies Following Horrific School Beating,link,http://ti.me/2pyF9ZS,2017-04-26 05:30:08,3675,148,517,690,11,106,4,1543,1321
10606591490_10154650927591491,A report found poor conditions and pay at the factory used by Ivanka Trump's clothing maker.,Workers at Factory for Ivanka Trump's Clothing Maker Earn About $62 a Week,link,http://ti.me/2qd8BRu,2017-04-26 01:00:38,11261,1085,6317,3826,60,1129,289,557,5400
10606591490_10154650592881491,Sarah Paulson responded to rumors that she would play Princess Di in 'Feud' at the #TIME100 Gala. http://ti.me/2qcGulx,Sarah Paulson Addresses Speculation That She Might Play the Late Princess Diana,link,http://ti.me/2ou3uQF,2017-04-25 22:00:18,128,5,5,114,4,7,3,0,0
10606591490_10154650318126491,"Cecile Richards: ""Women are waiting to see a sign from this White House that they're on our side."" #TIME100",Planned Parenthood's Cecile Richards Shares Her Thoughts On Ivanka Trump,link,http://ti.me/2q3ds8r,2017-04-25 19:30:19,117,15,4,108,6,0,0,2,1
10606591490_10154650151326491,"""My brother Evan was born female. He came out as transgender 16 years ago but never stopped wanting to have a baby. This spring he gave birth to his first child.""",My Brother's Pregnancy and the Making of a New American Family,link,http://ti.me/2pwiEET,2017-04-25 18:01:49,3154,630,584,2158,340,421,83,50,102
10606591490_10154649993451491,Patrick Hardison received the most complex face transplant in history. Here's how he's doing one year later.,What Life Looks Like After the World's Most Extensive Face Transplant,link,http://ti.me/2q3cpbC,2017-04-25 16:30:42,1016,28,77,865,85,63,2,1,0
10606591490_10154649624436491,People could access the videos of the child's murder on her father's Facebook page for roughly 24 hours.,Thai Man Posts Video of Himself Killing Daughter on Facebook,link,http://ti.me/2phYOwo,2017-04-25 14:01:15,673,63,42,211,5,27,1,138,291
10606591490_10154649377741491,"Caitlyn Jenner's new memoir details the story of the world's ""greatest athlete"" and most famous transgender woman.",9 Revelations From Caitlyn Jenner's Memoir 'The Secrets of My Life',link,http://ti.me/2phW7dU,2017-04-25 12:00:34,330,184,6,254,12,2,51,3,8
10606591490_1288118971284072,Trying to clean up your diet? Here are 5 simple steps in the right direction. http://trib.al/W5djmP9,5 Steps to Clean Eating,video,https://www.facebook.com/time/videos/1288118971284072/,2017-04-25 09:30:00,2024,75,927,1912,101,5,3,0,3
10606591490_10154648748061491,"President Donald J. Trump: ""This is a real threat to the world, whether we want to talk about it or not.""",Trump Calls for Tougher U.N. Sanctions Against North Korea,link,http://ti.me/2pgxT3N,2017-04-25 07:01:08,478,100,50,404,15,4,48,0,7
10606591490_10154648290106491,Barcelona is making it clear that tourists are no longer as welcome as they once were.,Why Barcelona Is Actively Trying to Push Away Tourists,link,http://ti.me/2oF2gh7,2017-04-25 02:00:34,4990,647,1393,3580,98,719,75,480,38
10606591490_10154647775246491,"Serena Williams: ""I will continue to take a lead and stand up for what's right.""",Serena Williams Responds to Alleged 'Racist' Comments About Her Baby,link,http://ti.me/2oGf8Up,2017-04-24 20:30:19,1942,57,103,1730,169,21,4,11,7
10606591490_1537891236244361,Here's how much it would cost you to vacation like a Kardashian. http://money.us/2o6kM1j,Here's How Much it Would Cost You to Vacation Like a Kardashian,video,https://www.facebook.com/time/videos/1537891236244361/,2017-04-24 20:00:00,112,32,12,99,4,2,4,0,3
10606591490_10154647670956491,Bill O'Reilly spoke out on his podcast Monday for the first time since his ouster from Fox News following sexual harassment allegations,Bill O'Reilly Is 'Sad' That He's 'Not on Television Anymore',link,http://ti.me/2pYioeR,2017-04-24 19:30:40,533,204,27,199,13,7,290,11,13
10606591490_10154647568751491,"Mexican drug lord Joaquín Guzmán, most commonly known as El Chapo, is reportedly having a tough time in prison",El Chapo Claims He's Kept In His Jail Cell 23 Hours a Day,link,http://ti.me/2pZo8aW,2017-04-24 18:30:08,1152,365,102,755,34,16,324,14,9
10606591490_1537818729584945,Looking for a new job this year? Here's how to make your resume stand out in 2017. http://money.us/2i5Z6Ea,Make Your Resume Stand Out in 2017,video,https://www.facebook.com/time/videos/1537818729584945/,2017-04-24 17:00:00,901,63,765,869,20,9,1,1,1
10606591490_10154647003411491,"Barack Obama to young leaders: It's time to ""take up the baton."" http://ti.me/2ptiJcv",The Return of Barack Obama,video,https://www.facebook.com/time/videos/10154647003411491/,2017-04-24 14:01:11,5658,204,817,4609,971,12,26,2,38
10606591490_10154646880656491,"New Orleans removes first of 4 Confederate statues: ""This is not about politics."" http://ti.me/2pdoJVN",New Orleans Removes Confederate Statue,video,https://www.facebook.com/time/videos/10154646880656491/,2017-04-24 13:01:27,2077,161,174,1631,302,27,19,12,86
10606591490_10154646643526491,President Donald Trump called to congratulate astronaut Peggy Whitson on setting a new U.S. record. http://ti.me/2oEGIS1,Trump Video Calls NASA Astronauts,video,https://www.facebook.com/time/videos/10154646643526491/,2017-04-24 12:00:00,254,40,44,213,9,4,10,0,18
10606591490_10154646093496491,John Oliver has a few questions about Ivanka Trump's and Jared Kushner's roles in the White House.,John Oliver Casts Some Shade on The White House,link,http://ti.me/2pVEK3m,2017-04-24 07:00:46,1595,51,195,1349,112,8,121,2,3
10606591490_10154779518123773,"From steamed veggies to sea beans, here's how a healthy dinner plate has evolved and where it might be headed. http://trib.al/4Fg99eN","60 Years of Dinner: Healthy Plates Then, Now and in the Future",video,https://www.facebook.com/time/videos/10154779518123773/,2017-04-23 23:00:00,181,12,28,164,10,5,1,1,0
10606591490_10154645159126491,This is what President Donald J. Trump will be doing instead of attending the annual event.,Trump To Hold A Rally The Night of White House Correspondents' Dinner,link,http://ti.me/2pUVHuT,2017-04-23 21:30:17,605,202,54,222,17,19,173,15,159
10606591490_10154645042281491,"As he nears his 100th day in office, President Donald J. Trump's approval ratings are historically low.",President Trump Has Historically Low Approval Ratings,link,http://ti.me/2oAA1Ac,2017-04-23 20:30:29,1216,134,153,813,72,12,310,1,8
10606591490_10154644988206491,Emmanuel Macron and Marine Le Pen have advanced to a runoff in France's presidential election. http://ti.me/2pUIIcM,Two Frontrunners Emerge in First Round of French Presidential ...,video,https://www.facebook.com/time/videos/10154644988206491/,2017-04-23 20:01:24,1121,205,279,945,42,104,6,8,16
10606591490_10154644590811491,"Here's a list of go-to's for those weeks when you're out of time, energy, and ideas.",What to Cook When You're Tired of Cooking,link,http://ti.me/2pMXuSy,2017-04-23 16:30:25,109,15,39,102,6,1,0,0,0
10606591490_10154644459731491,Eli Rosenbaum has spent his life pursuing war criminals –– just don't call him a Nazi hunter.,Inside the U.S. Effort to Find Nazi War Criminals Before It's Too Late,link,http://ti.me/2pqKZwo,2017-04-23 15:30:22,174,15,17,164,8,0,2,0,0
10606591490_10154644044056491,From the National Baseball Hall of Fame in New York to the Neon Museum in Nevada.,20 Tourist Attractions Worth the Money (and 5 That Aren't),link,http://ti.me/2pO4Q8B,2017-04-23 13:01:06,520,20,114,498,17,4,1,0,0
10606591490_10154643936646491,"""He was often kind of grossly inappropriate with the things he would say. And I think many of us experienced that.""",CNN Anchor Alisyn Camerota Reveals Roger Ailes Sexually Harassed Her,link,http://ti.me/2q4gatJ,2017-04-23 12:30:41,290,31,10,221,4,16,6,11,32
10606591490_10154643659766491,"It is still unclear why Tony Kim, who also goes by his Korean name Kim Sang-duk, was detained.",North Korea Detained a Third American Citizen Amid Rising Tensions With the U.S.,link,http://ti.me/2pqe7Uk,2017-04-23 11:30:04,948,108,153,681,9,55,47,19,137
10606591490_10154643598681491,"8. If a $2 bill has a red Treasury seal and serial numbers, it's at least a somewhat-valuable collectable.",18 Facts You Didn't Know About the $2 Bill,link,http://ti.me/2ouRSZj,2017-04-23 11:00:58,321,27,97,304,8,8,1,0,0
10606591490_10154643298146491,"Director Ron Howard, who played Moran's brother on 'Happy Days,' tweeted that it was ""such sad sad news.""",'Happy Days' Actress Erin Moran Dead at 56,link,http://ti.me/2q43cME,2017-04-23 08:30:23,467,44,69,233,19,6,1,207,1
10606591490_625905594274397,Melinda Gates works to ensure a better future for the world though her many charitable works. https://pen.live/TIME100,Melinda Gates On Her Charitable Work,video,https://www.facebook.com/time/videos/625905594274397/,2017-04-23 07:30:00,5662,75,1113,5039,596,8,12,2,5
10606591490_10154530336921463,"The real secret to Charleston's enduring appeal is not its timelessness, but rather its skill for reinvention.","The South's Best City: Charleston, S.C.",video,https://www.facebook.com/time/videos/10154530336921463/,2017-04-23 06:00:00,369,42,80,331,35,3,0,0,0
10606591490_10154618354430668,Here's how to make your pimples go away with ingredients you already have at home. http://trib.al/xfLQXnP,8 Home Ingredients That Make Pimples Vanish,video,https://www.facebook.com/time/videos/10154618354430668/,2017-04-23 04:00:00,1949,231,1723,1845,41,56,4,0,3
10606591490_10154642806961491,The IDs from these nine states do not meet the federal government's minimum security standards.,Driver Licenses From Nine States Won't Be Valid IDs for Domestic Flights in 2018,link,http://ti.me/2oxvXA6,2017-04-23 03:30:21,3236,338,4241,1970,18,769,72,43,364
10606591490_10154642412011491,"The father asked for an alternative route, but the controller on duty told him he did not have a better one.",These Were a Dad's Heartbreaking Last Words Before Crashing Plane on Family Vacation,link,http://ti.me/2pjxdLU,2017-04-22 22:30:15,2355,64,68,853,11,93,2,1383,13
10606591490_625905074274449,"John Legend shares his thoughts on the world today, and why he is optimistic for the future. https://pen.live/TIME100",John Legend on the World,video,https://www.facebook.com/time/videos/625905074274449/,2017-04-22 21:00:00,676,14,86,619,44,4,3,2,4
10606591490_10154641729711491,"Thousands protest and make friends in the rain at the March for Science
 http://ti.me/2pR7bQg",The World Marches for Science,video,https://www.facebook.com/time/videos/10154641729711491/,2017-04-22 16:46:05,3361,349,814,2755,511,17,65,4,9
10606591490_10154641553886491,"Anthony Bourdain: ""Wow, that's like four things I hate all in one sentence: Starbucks, unicorns, and the colors pink and purple.""",Anthony Bourdain Says the Unicorn Frappucino Is 'the Perfect Nexus of Awfulness',link,http://ti.me/2pQk0Yf,2017-04-22 15:30:13,5694,229,473,3685,306,15,1683,1,4
10606591490_10154641411171491,"Bill Nye addressed the March for Science in Washington, D.C., saying ""science must shape policy."" http://ti.me/2oxgX5R",Bill Nye in D.C.: 'Science Must Shape Policy',video,https://www.facebook.com/time/videos/10154641411171491/,2017-04-22 14:39:16,7596,112,2256,6552,1006,12,23,2,1
10606591490_10154640988541491,"Believe it or not, the rise in Mormon breast implants and $100,000 Jewish dowries can explain why you're alone on Saturday night.",What 2 Religions Tell Us About the Modern Dating Crisis,link,http://ti.me/2pMz3BR,2017-04-22 12:00:30,144,13,22,126,1,5,12,0,0
10606591490_10154640539121491,"The video shows a woman crying while holding her baby after the employee allegedly ""violently took a stroller,"" ""hitting her and just missing the baby.""",American Airlines Suspends Employee After Video Shows Altercation With Mom,link,http://ti.me/2owARxT,2017-04-22 08:30:05,1385,154,171,851,7,148,15,30,334
10606591490_10154640391281491,Watch Jane Goodall explain how China could be a leader when it comes to climate change. http://ti.me/2pmoDMy,Jane Goodall: How China Can Lead On Climate Change,video,https://www.facebook.com/time/videos/10154640391281491/,2017-04-22 07:31:30,1306,29,504,1125,153,25,2,1,0
10606591490_10154639884251491,It's hard not to be frightened of a drug that leaves a reptilian mark on its victims.,The World's Deadliest Drug: Inside a Krokodil Cookhouse,link,http://ti.me/2ocVweo,2017-04-22 02:00:58,548,64,136,415,4,42,2,79,6
10606591490_10155090112439985,"In honor of Queen Elizabeth II's 91st birthday, we took a look back at her sweetest moments with her beloved corgis.",Queen Elizabeth's Best Corgi Moments,video,https://www.facebook.com/time/videos/10155090112439985/,2017-04-21 21:00:00,3351,349,598,2846,463,9,32,0,1
10606591490_10154639388436491,"The Naked Cowboy: ""When I started this, my goal was to become the most celebrated entertainer of all time in a year or less.""","How Times Square's Naked Cowboy Makes $150,000 a Year",link,http://ti.me/2pOb1t2,2017-04-21 20:30:18,716,70,68,612,20,71,12,0,1
10606591490_10154890498337949,"These are the top 5 college majors where women make more than men.

See the full list: http://for.tn/2pS72s4",,video,https://www.facebook.com/time/videos/10154890498337949/,2017-04-21 20:00:00,344,47,100,309,10,25,0,0,0
10606591490_10155310102714073,Hit up 10 of the world's hottest nightlife destinations and get paid to do it with this epic internship. http://tandl.me/2ptZVGN,"This Internship Will Pay You to Party in Ibiza, Cancún, and Cr...",video,https://www.facebook.com/time/videos/10155310102714073/,2017-04-21 17:30:00,223,111,53,196,11,14,2,0,0
10606591490_10154638994721491,President Trump wants to meet Pope Francis. But the two world leaders have clashed in the past http://ti.me/2oy2TZ7,The Complicated Relationship of Trump and the Pope,video,https://www.facebook.com/time/videos/10154638994721491/,2017-04-21 17:00:56,245,126,52,150,8,6,59,1,21
10606591490_10154638948431491,"Any type of exercise is good for your health, but a recent study points to this type of training to improve age-related changes.",The Type of Exercise That Helps You Live Longer,link,http://ti.me/2pmLurb,2017-04-21 16:30:22,1622,45,617,1569,35,14,3,1,0
10606591490_10154638888191491,"After her comments on Elizabeth Warren and her photo mocking Hillary Clinton, social media is not happy with Sarah Palin.",'Sarah Palin Is on a Roll of Wrongness This Week',link,http://ti.me/2pMNuGf,2017-04-21 16:02:28,2182,889,95,1088,34,44,392,25,599
10606591490_625927037605586,Tony and Oscar winner Viola Davis describes her passion for acting and how it makes her a rebel: https://pen.live/TIME100,Viola Davis on Being a Rebel,video,https://www.facebook.com/time/videos/625927037605586/,2017-04-21 15:00:00,1718,44,225,1386,322,7,2,1,0
10606591490_10154638673781491,The number of women who visited their doctor to discuss IUDs rose nearly 19% since the 2016 election.,Everything You Need to Know Before Getting An IUD,link,http://ti.me/2pNoyBd,2017-04-21 14:30:12,300,31,27,280,11,6,2,0,1
10606591490_625926757605614,"Riz MC has often felt like a fish out of water, yet found a way to channel his energy into a creative outlet. More here: https://pen.live/TIME100",Riz Ahmed on Feeling Like a Fish Out of Water,video,https://www.facebook.com/time/videos/625926757605614/,2017-04-21 14:00:00,375,23,39,337,31,1,0,0,6
10606591490_10154638509451491,"""If this coworker is a disher, other people probably know it, and you could get a bad rap by association.""",How to Avoid Your Gossipy Co-Worker,link,http://ti.me/2oua7yg,2017-04-21 13:30:08,141,7,29,129,7,4,1,0,0
10606591490_10154638161136491,"Maxine Waters: ""A day will come when rich men won't be able to buy their way out of criminal conduct and they will go to jail.""",Here's How Women Are Reacting to Bill O'Reilly Being Ousted by Fox,link,http://ti.me/2p31uh6,2017-04-21 11:00:06,690,57,31,626,39,6,17,0,2
10606591490_10154637823426491,"""I would like to officially announce that I will no longer be seeking a third term.""",Watch Colbert Make a Trump Impersonator Say What Trump Never Would,link,http://ti.me/2pM4MpC,2017-04-21 08:30:36,352,24,32,280,10,2,60,0,0
